<?xml version="1.0" encoding="utf-8"?>
<feed xmlns="http://www.w3.org/2005/Atom">
    <title>p0n4ik rulez!</title>
    <link href="https://p0n4ik008.github.io/atom.xml" rel="self" />
    <link href="https://p0n4ik008.github.io" />
    <id>https://p0n4ik008.github.io/atom.xml</id>
    <author>
        <name>p0n4ik</name>
        
        <email>76661235+p0n4ik008@users.noreply.github.com</email>
        
    </author>
    <updated>2024-09-20T00:00:00Z</updated>
    <entry>
    <title>виды горных трав</title>
    <link href="https://p0n4ik008.github.io/posts/travy.html" />
    <id>https://p0n4ik008.github.io/posts/travy.html</id>
    <published>20.09.2024</published>
    <updated>2024-09-20T00:00:00Z</updated>
    <summary type="html"><![CDATA[<p>
<a href="/posts/travy.html">виды горных трав</a><br />
20 сентября 2024

</p>
<p><img src="../content/WhatsApp%20Image%202024-09-19%20at%2023.17.37.jpeg" /></p>
<div class="separator">
    
      Запощено в <a title="All pages tagged &#39;бабы&#39;." href="/tags/%D0%B1%D0%B0%D0%B1%D1%8B.html" rel="tag">бабы</a>
    
    <span class="disqus-comment-count" data-disqus-identifier="posts/travy.md"></span>
</div>
]]></summary>
</entry>
<entry>
    <title>отчаянные меры</title>
    <link href="https://p0n4ik008.github.io/posts/mery.html" />
    <id>https://p0n4ik008.github.io/posts/mery.html</id>
    <published>12.08.2024</published>
    <updated>2024-08-12T00:00:00Z</updated>
    <summary type="html"><![CDATA[<p>
<a href="/posts/mery.html">отчаянные меры</a><br />
12 августа 2024

</p>
<p><img src="../content/WhatsApp%20Image%202024-08-12%20at%2021.59.19.jpeg" /></p>
<div class="separator">
    
      Запощено в <a title="All pages tagged &#39;сэкс&#39;." href="/tags/%D1%81%D1%8D%D0%BA%D1%81.html" rel="tag">сэкс</a>
    
    <span class="disqus-comment-count" data-disqus-identifier="posts/mery.md"></span>
</div>
]]></summary>
</entry>
<entry>
    <title>подборка весёлых картинок 3</title>
    <link href="https://p0n4ik008.github.io/posts/podborka3.html" />
    <id>https://p0n4ik008.github.io/posts/podborka3.html</id>
    <published>07.08.2024</published>
    <updated>2024-08-07T00:00:00Z</updated>
    <summary type="html"><![CDATA[<p>
<a href="/posts/podborka3.html">подборка весёлых картинок 3</a><br />
 7 августа 2024

</p>
<p><img src="../content/WhatsApp%20Image%202024-08-07%20at%2021.21.21.jpeg" width="742" /></p>
<p><img src="../content/WhatsApp%20Image%202024-08-07%20at%2021.21.29.jpeg" /></p>
<div class="separator">
    
      Запощено в <a title="All pages tagged &#39;бабы&#39;." href="/tags/%D0%B1%D0%B0%D0%B1%D1%8B.html" rel="tag">бабы</a>, <a title="All pages tagged &#39;сэкс&#39;." href="/tags/%D1%81%D1%8D%D0%BA%D1%81.html" rel="tag">сэкс</a>
    
    <span class="disqus-comment-count" data-disqus-identifier="posts/podborka3.md"></span>
</div>
]]></summary>
</entry>
<entry>
    <title>подборка весёлых картинок 2</title>
    <link href="https://p0n4ik008.github.io/posts/podborka2.html" />
    <id>https://p0n4ik008.github.io/posts/podborka2.html</id>
    <published>25.07.2024</published>
    <updated>2024-07-25T00:00:00Z</updated>
    <summary type="html"><![CDATA[<p>
<a href="/posts/podborka2.html">подборка весёлых картинок 2</a><br />
25 июля 2024

</p>
<p><img src="../content/WhatsApp%20Image%202024-07-25%20at%2020.36.48.jpeg" /></p>
<p><img src="../content/WhatsApp%20Image%202024-07-25%20at%2020.38.28.jpeg" /></p>
<p><span class="math inline"><video controls>
<source src="../content/WhatsApp Video 2024-07-25 at 20.36.26.mp4" preload="metadata">
</video>
</span></p>
<p><img src="../content/WhatsApp%20Image%202024-07-25%20at%2020.36.58.jpeg" /></p>
<p><img src="../content/WhatsApp%20Image%202024-07-25%20at%2020.38.41.jpeg" width="742" /></p>
<div class="separator">
    
      Запощено в <a title="All pages tagged &#39;бабы&#39;." href="/tags/%D0%B1%D0%B0%D0%B1%D1%8B.html" rel="tag">бабы</a>, <a title="All pages tagged &#39;сэкс&#39;." href="/tags/%D1%81%D1%8D%D0%BA%D1%81.html" rel="tag">сэкс</a>
    
    <span class="disqus-comment-count" data-disqus-identifier="posts/podborka2.md"></span>
</div>
]]></summary>
</entry>
<entry>
    <title>Телеканал Культура</title>
    <link href="https://p0n4ik008.github.io/posts/culture.html" />
    <id>https://p0n4ik008.github.io/posts/culture.html</id>
    <published>29.05.2024</published>
    <updated>2024-05-29T00:00:00Z</updated>
    <summary type="html"><![CDATA[<p>
<a href="/posts/culture.html">Телеканал Культура</a><br />
29 мая 2024

</p>
<p>Текст Кончаловского<br />
Музыка Трахмутовой<br />
Голос Распердолиной и Перепердолиной в народном творчестве шлюхозавров, в большом и малых анальных театрах<br />
Поэзия ебландэсского века, пуки и трахи, охи и вздохи современности<br />
Совокупление субъектов гражданского общества, общий аналлиз калловых масс и спермодермий, разбор по порядку анально-пролетарского порядка, в гостях у Залупкина и Хуюшкина<br />
Кончибельность поэзии как предмет для творчества в современном шлюховском обществе<br />
Распердун перепердольский, рассказывает в своём пиздёжном вещании на телек-анале культура</p>
<div class="separator">
    
      Запощено в <a title="All pages tagged &#39;цитаты&#39;." href="/tags/%D1%86%D0%B8%D1%82%D0%B0%D1%82%D1%8B.html" rel="tag">цитаты</a>
    
    <span class="disqus-comment-count" data-disqus-identifier="posts/culture.md"></span>
</div>
]]></summary>
</entry>
<entry>
    <title>ни слова Андрейке часть вторая</title>
    <link href="https://p0n4ik008.github.io/posts/andreyka2.html" />
    <id>https://p0n4ik008.github.io/posts/andreyka2.html</id>
    <published>29.01.2024</published>
    <updated>2024-01-29T00:00:00Z</updated>
    <summary type="html"><![CDATA[<p>
<a href="/posts/andreyka2.html">ни слова Андрейке часть вторая</a><br />
29 января 2024

</p>
<p><span class="math inline"><video controls>
<source src="/content/20240204_114145_WhatsApp_Video 2024-01-29 at 22.07.25.mp4" preload="metadata">
</video>
</span></p>
<div class="separator">
    
      Запощено в <a title="All pages tagged &#39;сэкс&#39;." href="/tags/%D1%81%D1%8D%D0%BA%D1%81.html" rel="tag">сэкс</a>
    
    <span class="disqus-comment-count" data-disqus-identifier="posts/andreyka2.md"></span>
</div>
]]></summary>
</entry>
<entry>
    <title>подборка весёлых картинок</title>
    <link href="https://p0n4ik008.github.io/posts/podborka.html" />
    <id>https://p0n4ik008.github.io/posts/podborka.html</id>
    <published>20.01.2024</published>
    <updated>2024-01-20T00:00:00Z</updated>
    <summary type="html"><![CDATA[<p>
<a href="/posts/podborka.html">подборка весёлых картинок</a><br />
20 января 2024

</p>
<p><img src="../content/20240120_155250_WhatsApp_Image%202024-01-20%20at%2015.46.20.jpeg" width="742" /></p>
<p><img src="../content/20240120_155250_WhatsApp_Image%202024-01-20%20at%2015.45.29.jpeg" /></p>
<p><img src="../content/20240120_155250_WhatsApp_Image%202024-01-20%20at%2015.45.59.jpeg" /></p>
<p><span class="math inline"><video controls>
<source src="../content/20240120_155348_WhatsApp_Video 2024-01-20 at 15.46.54.mp4" preload="metadata">
</video>
</span></p>
<p><img src="../content/20240204_114303_WhatsApp_Image%202024-01-20%20at%2015.47.10.jpeg" /></p>
<div class="separator">
    
      Запощено в <a title="All pages tagged &#39;бабы&#39;." href="/tags/%D0%B1%D0%B0%D0%B1%D1%8B.html" rel="tag">бабы</a>
    
    <span class="disqus-comment-count" data-disqus-identifier="posts/podborka.md"></span>
</div>
]]></summary>
</entry>
<entry>
    <title>чтобы было что поставить на стол</title>
    <link href="https://p0n4ik008.github.io/posts/newyear2.html" />
    <id>https://p0n4ik008.github.io/posts/newyear2.html</id>
    <published>31.12.2023</published>
    <updated>2023-12-31T00:00:00Z</updated>
    <summary type="html"><![CDATA[<p>
<a href="/posts/newyear2.html">чтобы было что поставить на стол</a><br />
31 декабря 2023

</p>
<p><img src="../content/20240120_155109_WhatsApp_Image%202024-01-20%20at%2015.46.43.jpeg" /></p>
<div class="separator">
    
      Запощено в <a title="All pages tagged &#39;сэкс&#39;." href="/tags/%D1%81%D1%8D%D0%BA%D1%81.html" rel="tag">сэкс</a>
    
    <span class="disqus-comment-count" data-disqus-identifier="posts/newyear2.md"></span>
</div>
]]></summary>
</entry>
<entry>
    <title>путь к женщинам лежит через желудок</title>
    <link href="https://p0n4ik008.github.io/posts/put.html" />
    <id>https://p0n4ik008.github.io/posts/put.html</id>
    <published>23.12.2023</published>
    <updated>2023-12-23T00:00:00Z</updated>
    <summary type="html"><![CDATA[<p>
<a href="/posts/put.html">путь к женщинам лежит через желудок</a><br />
23 декабря 2023

</p>
<p><span class="math inline"><video controls>
<source src="../content/WhatsApp Video 2023-12-23 at 22.07.07.mp4" preload="metadata">
</video>
</span></p>
<div class="separator">
    
      Запощено в <a title="All pages tagged &#39;бабы&#39;." href="/tags/%D0%B1%D0%B0%D0%B1%D1%8B.html" rel="tag">бабы</a>
    
    <span class="disqus-comment-count" data-disqus-identifier="posts/put.md"></span>
</div>
]]></summary>
</entry>
<entry>
    <title>отработка навыков</title>
    <link href="https://p0n4ik008.github.io/posts/icecream.html" />
    <id>https://p0n4ik008.github.io/posts/icecream.html</id>
    <published>28.11.2023</published>
    <updated>2023-11-28T00:00:00Z</updated>
    <summary type="html"><![CDATA[<p>
<a href="/posts/icecream.html">отработка навыков</a><br />
28 ноября 2023

</p>
<p><span class="math inline"><video controls>
<source src="../content/WhatsApp Video 2023-11-28 at 07.02.03.mp4" preload="metadata">
</video>
</span></p>
<div class="separator">
    
      Запощено в <a title="All pages tagged &#39;сэкс&#39;." href="/tags/%D1%81%D1%8D%D0%BA%D1%81.html" rel="tag">сэкс</a>
    
    <span class="disqus-comment-count" data-disqus-identifier="posts/icecream.md"></span>
</div>
]]></summary>
</entry>
<entry>
    <title>первое правило эксплуатации транспортного средства</title>
    <link href="https://p0n4ik008.github.io/posts/truba.html" />
    <id>https://p0n4ik008.github.io/posts/truba.html</id>
    <published>26.11.2023</published>
    <updated>2023-11-26T00:00:00Z</updated>
    <summary type="html"><![CDATA[<p>
<a href="/posts/truba.html">первое правило эксплуатации транспортного средства</a><br />
26 ноября 2023

</p>
<p><img src="../content/20231224_161132_WhatsApp_Image%202023-11-26%20at%2017.47.34.jpeg" /></p>
<div class="separator">
    
      Запощено в без рубрики
    
    <span class="disqus-comment-count" data-disqus-identifier="posts/truba.md"></span>
</div>
]]></summary>
</entry>
<entry>
    <title>инструкция по использованию пилотки</title>
    <link href="https://p0n4ik008.github.io/posts/pilotka.html" />
    <id>https://p0n4ik008.github.io/posts/pilotka.html</id>
    <published>26.11.2023</published>
    <updated>2023-11-26T00:00:00Z</updated>
    <summary type="html"><![CDATA[<p>
<a href="/posts/pilotka.html">инструкция по использованию пилотки</a><br />
26 ноября 2023

</p>
<p><img src="../content/20231224_160709_e1cbde4c-aca5-439b-a760-ceba1f06da9a.jpg" /></p>
<div class="separator">
    
      Запощено в <a title="All pages tagged &#39;бабы&#39;." href="/tags/%D0%B1%D0%B0%D0%B1%D1%8B.html" rel="tag">бабы</a>
    
    <span class="disqus-comment-count" data-disqus-identifier="posts/pilotka.md"></span>
</div>
]]></summary>
</entry>
<entry>
    <title>генеральная уборка</title>
    <link href="https://p0n4ik008.github.io/posts/clean.html" />
    <id>https://p0n4ik008.github.io/posts/clean.html</id>
    <published>26.11.2023</published>
    <updated>2023-11-26T00:00:00Z</updated>
    <summary type="html"><![CDATA[<p>
<a href="/posts/clean.html">генеральная уборка</a><br />
26 ноября 2023

</p>
<p><img src="../content/20231224_161450_WhatsApp_Image%202023-11-26%20at%2017.47.34%20(1).jpeg" /></p>
<div class="separator">
    
      Запощено в <a title="All pages tagged &#39;оружие&#39;." href="/tags/%D0%BE%D1%80%D1%83%D0%B6%D0%B8%D0%B5.html" rel="tag">оружие</a>
    
    <span class="disqus-comment-count" data-disqus-identifier="posts/clean.md"></span>
</div>
]]></summary>
</entry>
<entry>
    <title>секс с едой ч2</title>
    <link href="https://p0n4ik008.github.io/posts/sekssedoy.html" />
    <id>https://p0n4ik008.github.io/posts/sekssedoy.html</id>
    <published>15.10.2023</published>
    <updated>2023-10-15T00:00:00Z</updated>
    <summary type="html"><![CDATA[<p>
<a href="/posts/sekssedoy.html">секс с едой ч2</a><br />
15 октября 2023

</p>
<p><span class="math inline"><video controls>
<source src="../content/20231022_162120_WhatsApp_Video 2023-10-17 at 10.12.27.mp4" preload="metadata">
</video>
</span></p>
<div class="separator">
    
      Запощено в <a title="All pages tagged &#39;сэкс&#39;." href="/tags/%D1%81%D1%8D%D0%BA%D1%81.html" rel="tag">сэкс</a>
    
    <span class="disqus-comment-count" data-disqus-identifier="posts/sekssedoy.md"></span>
</div>
]]></summary>
</entry>
<entry>
    <title>на дне лебединого озера</title>
    <link href="https://p0n4ik008.github.io/posts/lebed.html" />
    <id>https://p0n4ik008.github.io/posts/lebed.html</id>
    <published>15.10.2023</published>
    <updated>2023-10-15T00:00:00Z</updated>
    <summary type="html"><![CDATA[<p>
<a href="/posts/lebed.html">на дне лебединого озера</a><br />
15 октября 2023

</p>
<p><img src="../content/20231022_161419_WhatsApp_Image%202023-10-17%20at%2010.16.30.jpeg" /></p>
<div class="separator">
    
      Запощено в <a title="All pages tagged &#39;бабы&#39;." href="/tags/%D0%B1%D0%B0%D0%B1%D1%8B.html" rel="tag">бабы</a>
    
    <span class="disqus-comment-count" data-disqus-identifier="posts/lebed.md"></span>
</div>
]]></summary>
</entry>
<entry>
    <title>визит к окулисту</title>
    <link href="https://p0n4ik008.github.io/posts/glaza.html" />
    <id>https://p0n4ik008.github.io/posts/glaza.html</id>
    <published>15.10.2023</published>
    <updated>2023-10-15T00:00:00Z</updated>
    <summary type="html"><![CDATA[<p>
<a href="/posts/glaza.html">визит к окулисту</a><br />
15 октября 2023

</p>
<p><img src="../content/20231022_161739_WhatsApp_Image%202023-10-17%20at%2010.13.30.jpeg" /></p>
<div class="separator">
    
      Запощено в <a title="All pages tagged &#39;бабы&#39;." href="/tags/%D0%B1%D0%B0%D0%B1%D1%8B.html" rel="tag">бабы</a>
    
    <span class="disqus-comment-count" data-disqus-identifier="posts/glaza.md"></span>
</div>
]]></summary>
</entry>
<entry>
    <title>спасает жизнь</title>
    <link href="https://p0n4ik008.github.io/posts/poebatsa.html" />
    <id>https://p0n4ik008.github.io/posts/poebatsa.html</id>
    <published>03.06.2023</published>
    <updated>2023-06-03T00:00:00Z</updated>
    <summary type="html"><![CDATA[<p>
<a href="/posts/poebatsa.html">спасает жизнь</a><br />
 3 июня 2023

</p>
<p><img src="../content/20230611_114007_WhatsApp_Image%202023-06-03%20at%2011.38.24.jpeg" width="742" /></p>
<div class="separator">
    
      Запощено в <a title="All pages tagged &#39;сэкс&#39;." href="/tags/%D1%81%D1%8D%D0%BA%D1%81.html" rel="tag">сэкс</a>
    
    <span class="disqus-comment-count" data-disqus-identifier="posts/poebatsa.md"></span>
</div>
]]></summary>
</entry>
<entry>
    <title>поебаться чтобы повидаться</title>
    <link href="https://p0n4ik008.github.io/posts/sos.html" />
    <id>https://p0n4ik008.github.io/posts/sos.html</id>
    <published>02.06.2023</published>
    <updated>2023-06-02T00:00:00Z</updated>
    <summary type="html"><![CDATA[<p>
<a href="/posts/sos.html">поебаться чтобы повидаться</a><br />
 2 июня 2023

</p>
<p><img src="../content/20230611_114442_WhatsApp_Image%202023-06-02%20at%2011.54.21.jpeg" width="742" /></p>
<div class="separator">
    
      Запощено в <a title="All pages tagged &#39;сэкс&#39;." href="/tags/%D1%81%D1%8D%D0%BA%D1%81.html" rel="tag">сэкс</a>
    
    <span class="disqus-comment-count" data-disqus-identifier="posts/sos.md"></span>
</div>
]]></summary>
</entry>
<entry>
    <title>Стесняюсь спросить</title>
    <link href="https://p0n4ik008.github.io/posts/kupalnik.html" />
    <id>https://p0n4ik008.github.io/posts/kupalnik.html</id>
    <published>25.05.2023</published>
    <updated>2023-05-25T00:00:00Z</updated>
    <summary type="html"><![CDATA[<p>
<a href="/posts/kupalnik.html">Стесняюсь спросить</a><br />
25 мая 2023

</p>
<p><img src="../content/20230527_134545_WhatsApp_Image%202023-05-25%20at%2019.52.02.jpeg" /></p>
<div class="separator">
    
      Запощено в <a title="All pages tagged &#39;бабы&#39;." href="/tags/%D0%B1%D0%B0%D0%B1%D1%8B.html" rel="tag">бабы</a>
    
    <span class="disqus-comment-count" data-disqus-identifier="posts/kupalnik.md"></span>
</div>
]]></summary>
</entry>
<entry>
    <title>А я бы вот с такими полетал бы стюардессосочками</title>
    <link href="https://p0n4ik008.github.io/posts/stewardess.html" />
    <id>https://p0n4ik008.github.io/posts/stewardess.html</id>
    <published>16.05.2023</published>
    <updated>2023-05-16T00:00:00Z</updated>
    <summary type="html"><![CDATA[<p>
<a href="/posts/stewardess.html">А я бы вот с такими полетал бы стюардессосочками</a><br />
16 мая 2023

</p>
<p><img src="../content/20230527_133848_a02cf8c5-fa02-4971-9dc8-b7870091b668.jpg" width="742" /></p>
<div class="separator">
    
      Запощено в <a title="All pages tagged &#39;бабы&#39;." href="/tags/%D0%B1%D0%B0%D0%B1%D1%8B.html" rel="tag">бабы</a>
    
    <span class="disqus-comment-count" data-disqus-identifier="posts/stewardess.md"></span>
</div>
]]></summary>
</entry>
<entry>
    <title>заебали</title>
    <link href="https://p0n4ik008.github.io/posts/zaebali.html" />
    <id>https://p0n4ik008.github.io/posts/zaebali.html</id>
    <published>08.04.2023</published>
    <updated>2023-04-08T00:00:00Z</updated>
    <summary type="html"><![CDATA[<p>
<a href="/posts/zaebali.html">заебали</a><br />
 8 апреля 2023

</p>
<p><img src="../content/WhatsApp%20Image%202023-04-08%20at%2013.58.23.jpeg" /></p>
<div class="separator">
    
      Запощено в <a title="All pages tagged &#39;сэкс&#39;." href="/tags/%D1%81%D1%8D%D0%BA%D1%81.html" rel="tag">сэкс</a>
    
    <span class="disqus-comment-count" data-disqus-identifier="posts/zaebali.md"></span>
</div>
]]></summary>
</entry>
<entry>
    <title>стрижка газона</title>
    <link href="https://p0n4ik008.github.io/posts/trim.html" />
    <id>https://p0n4ik008.github.io/posts/trim.html</id>
    <published>08.04.2023</published>
    <updated>2023-04-08T00:00:00Z</updated>
    <summary type="html"><![CDATA[<p>
<a href="/posts/trim.html">стрижка газона</a><br />
 8 апреля 2023

</p>
<p><span class="math inline"><video controls>
<source src="/content/WhatsApp Video 2023-04-08 at 13.59.05.mp4" preload="metadata">
</video>
</span></p>
<div class="separator">
    
      Запощено в <a title="All pages tagged &#39;сэкс&#39;." href="/tags/%D1%81%D1%8D%D0%BA%D1%81.html" rel="tag">сэкс</a>
    
    <span class="disqus-comment-count" data-disqus-identifier="posts/trim.md"></span>
</div>
]]></summary>
</entry>
<entry>
    <title>рот не закрывался</title>
    <link href="https://p0n4ik008.github.io/posts/rot3.html" />
    <id>https://p0n4ik008.github.io/posts/rot3.html</id>
    <published>08.04.2023</published>
    <updated>2023-04-08T00:00:00Z</updated>
    <summary type="html"><![CDATA[<p>
<a href="/posts/rot3.html">рот не закрывался</a><br />
 8 апреля 2023

</p>
<p><span class="math inline"><video controls>
<source src="/content/WhatsApp Video 2023-04-08 at 13.59.16.mp4" preload="metadata">
</video>
</span></p>
<div class="separator">
    
      Запощено в <a title="All pages tagged &#39;сэкс&#39;." href="/tags/%D1%81%D1%8D%D0%BA%D1%81.html" rel="tag">сэкс</a>
    
    <span class="disqus-comment-count" data-disqus-identifier="posts/rot3.md"></span>
</div>
]]></summary>
</entry>
<entry>
    <title>пиздатые вещи</title>
    <link href="https://p0n4ik008.github.io/posts/pizdato.html" />
    <id>https://p0n4ik008.github.io/posts/pizdato.html</id>
    <published>08.04.2023</published>
    <updated>2023-04-08T00:00:00Z</updated>
    <summary type="html"><![CDATA[<p>
<a href="/posts/pizdato.html">пиздатые вещи</a><br />
 8 апреля 2023

</p>
<p><img src="../content/WhatsApp%20Image%202023-04-08%20at%2013.58.36.jpeg" width="742" />
<span class="math inline"><video controls>
<source src="/content/WhatsApp Video 2023-04-08 at 13.58.55.mp4" preload="metadata">
</video>
</span></p>
<div class="separator">
    
      Запощено в <a title="All pages tagged &#39;сэкс&#39;." href="/tags/%D1%81%D1%8D%D0%BA%D1%81.html" rel="tag">сэкс</a>
    
    <span class="disqus-comment-count" data-disqus-identifier="posts/pizdato.md"></span>
</div>
]]></summary>
</entry>
<entry>
    <title>моё ты золото</title>
    <link href="https://p0n4ik008.github.io/posts/gold.html" />
    <id>https://p0n4ik008.github.io/posts/gold.html</id>
    <published>08.04.2023</published>
    <updated>2023-04-08T00:00:00Z</updated>
    <summary type="html"><![CDATA[<p>
<a href="/posts/gold.html">моё ты золото</a><br />
 8 апреля 2023

</p>
<p><img src="../content/WhatsApp%20Image%202023-04-08%20at%2013.59.26.jpeg" /></p>
<div class="separator">
    
      Запощено в <a title="All pages tagged &#39;сэкс&#39;." href="/tags/%D1%81%D1%8D%D0%BA%D1%81.html" rel="tag">сэкс</a>
    
    <span class="disqus-comment-count" data-disqus-identifier="posts/gold.md"></span>
</div>
]]></summary>
</entry>
<entry>
    <title>стеснительная азиатка</title>
    <link href="https://p0n4ik008.github.io/posts/shy.html" />
    <id>https://p0n4ik008.github.io/posts/shy.html</id>
    <published>30.03.2023</published>
    <updated>2023-03-30T00:00:00Z</updated>
    <summary type="html"><![CDATA[<p>
<a href="/posts/shy.html">стеснительная азиатка</a><br />
30 марта 2023

</p>
<p><span class="math inline"><video controls>
<source src="/content/amazingtt3.mp4" preload="metadata">
</video>
</span></p>
<div class="separator">
    
      Запощено в <a title="All pages tagged &#39;бабы&#39;." href="/tags/%D0%B1%D0%B0%D0%B1%D1%8B.html" rel="tag">бабы</a>
    
    <span class="disqus-comment-count" data-disqus-identifier="posts/shy.md"></span>
</div>
]]></summary>
</entry>
<entry>
    <title>с праздником, девчата!</title>
    <link href="https://p0n4ik008.github.io/posts/8marta.html" />
    <id>https://p0n4ik008.github.io/posts/8marta.html</id>
    <published>08.03.2023</published>
    <updated>2023-03-08T00:00:00Z</updated>
    <summary type="html"><![CDATA[<p>
<a href="/posts/8marta.html">с праздником, девчата!</a><br />
 8 марта 2023

</p>
<p><img src="../content/WhatsApp%20Image%202023-03-08%20at%2010.03.19.jpeg" />
<img src="../content/WhatsApp%20Image%202023-03-08%20at%2010.07.29.jpeg" /></p>
<div class="separator">
    
      Запощено в <a title="All pages tagged &#39;сэкс&#39;." href="/tags/%D1%81%D1%8D%D0%BA%D1%81.html" rel="tag">сэкс</a>
    
    <span class="disqus-comment-count" data-disqus-identifier="posts/8marta.md"></span>
</div>
]]></summary>
</entry>
<entry>
    <title>гжэль</title>
    <link href="https://p0n4ik008.github.io/posts/gjel.html" />
    <id>https://p0n4ik008.github.io/posts/gjel.html</id>
    <published>03.03.2023</published>
    <updated>2023-03-03T00:00:00Z</updated>
    <summary type="html"><![CDATA[<p>
<a href="/posts/gjel.html">гжэль</a><br />
 3 марта 2023

</p>
<p><img src="/content/WhatsApp%20Image%202023-03-03%20at%2009.35.47.jpeg" /></p>
<div class="separator">
    
      Запощено в <a title="All pages tagged &#39;сэкс&#39;." href="/tags/%D1%81%D1%8D%D0%BA%D1%81.html" rel="tag">сэкс</a>
    
    <span class="disqus-comment-count" data-disqus-identifier="posts/gjel.md"></span>
</div>
]]></summary>
</entry>
<entry>
    <title>ааа аа а</title>
    <link href="https://p0n4ik008.github.io/posts/aaa.html" />
    <id>https://p0n4ik008.github.io/posts/aaa.html</id>
    <published>24.01.2023</published>
    <updated>2023-01-24T00:00:00Z</updated>
    <summary type="html"><![CDATA[<p>
<a href="/posts/aaa.html">ааа аа а</a><br />
24 января 2023

</p>
<video controls width="742px">
<source src="/content/WhatsApp Video 2023-01-24 at 16.48.38.mp4" preload="metadata">
</video>
<div class="separator">
    
      Запощено в <a title="All pages tagged &#39;сэкс&#39;." href="/tags/%D1%81%D1%8D%D0%BA%D1%81.html" rel="tag">сэкс</a>
    
    <span class="disqus-comment-count" data-disqus-identifier="posts/aaa.md"></span>
</div>
]]></summary>
</entry>
<entry>
    <title>космический пончик</title>
    <link href="https://p0n4ik008.github.io/posts/ponchik.html" />
    <id>https://p0n4ik008.github.io/posts/ponchik.html</id>
    <published>14.01.2023</published>
    <updated>2023-01-14T00:00:00Z</updated>
    <summary type="html"><![CDATA[<p>
<a href="/posts/ponchik.html">космический пончик</a><br />
14 января 2023

</p>
<p>«Хаббл» запечатлел, как чёрная дыра превратила звезду в «космический пончик»</p>
<p><img src="/content/space_donut_01.jpg" />
<img src="/content/space_donut_02.jpg" /></p>
<div class="separator">
    
      Запощено в <a title="All pages tagged &#39;пончики&#39;." href="/tags/%D0%BF%D0%BE%D0%BD%D1%87%D0%B8%D0%BA%D0%B8.html" rel="tag">пончики</a>
    
    <span class="disqus-comment-count" data-disqus-identifier="posts/ponchik.md"></span>
</div>
]]></summary>
</entry>
<entry>
    <title>хитровыебанная</title>
    <link href="https://p0n4ik008.github.io/posts/hitro.html" />
    <id>https://p0n4ik008.github.io/posts/hitro.html</id>
    <published>29.12.2022</published>
    <updated>2022-12-29T00:00:00Z</updated>
    <summary type="html"><![CDATA[<p>
<a href="/posts/hitro.html">хитровыебанная</a><br />
29 декабря 2022

</p>
<p><img src="/content/WhatsApp%20Image%202022-12-29%20at%2013.25.47.jpeg" /></p>
<div class="separator">
    
      Запощено в <a title="All pages tagged &#39;сэкс&#39;." href="/tags/%D1%81%D1%8D%D0%BA%D1%81.html" rel="tag">сэкс</a>
    
    <span class="disqus-comment-count" data-disqus-identifier="posts/hitro.md"></span>
</div>
]]></summary>
</entry>
<entry>
    <title>календарь на 2023 год</title>
    <link href="https://p0n4ik008.github.io/posts/calendar.html" />
    <id>https://p0n4ik008.github.io/posts/calendar.html</id>
    <published>29.12.2022</published>
    <updated>2022-12-29T00:00:00Z</updated>
    <summary type="html"><![CDATA[<p>
<a href="/posts/calendar.html">календарь на 2023 год</a><br />
29 декабря 2022

</p>
<embed src="/content/calendar 2023.pdf" type="application/pdf" width="100%" height="1200px" />
<div class="separator">
    
      Запощено в <a title="All pages tagged &#39;бабы&#39;." href="/tags/%D0%B1%D0%B0%D0%B1%D1%8B.html" rel="tag">бабы</a>
    
    <span class="disqus-comment-count" data-disqus-identifier="posts/calendar.md"></span>
</div>
]]></summary>
</entry>
<entry>
    <title>картофельные ёбла</title>
    <link href="https://p0n4ik008.github.io/posts/ebla.html" />
    <id>https://p0n4ik008.github.io/posts/ebla.html</id>
    <published>10.12.2022</published>
    <updated>2022-12-10T00:00:00Z</updated>
    <summary type="html"><![CDATA[<p>
<a href="/posts/ebla.html">картофельные ёбла</a><br />
10 декабря 2022

</p>
<p>🙂</p>
<p><img src="/content/WhatsApp%20Image%202022-12-10%20at%2011.36.06.jpeg" /></p>
<div class="separator">
    
      Запощено в <a title="All pages tagged &#39;пончики&#39;." href="/tags/%D0%BF%D0%BE%D0%BD%D1%87%D0%B8%D0%BA%D0%B8.html" rel="tag">пончики</a>
    
    <span class="disqus-comment-count" data-disqus-identifier="posts/ebla.md"></span>
</div>
]]></summary>
</entry>
<entry>
    <title>велик урал</title>
    <link href="https://p0n4ik008.github.io/posts/ural.html" />
    <id>https://p0n4ik008.github.io/posts/ural.html</id>
    <published>25.11.2022</published>
    <updated>2022-11-25T00:00:00Z</updated>
    <summary type="html"><![CDATA[<p>
<a href="/posts/ural.html">велик урал</a><br />
25 ноября 2022

</p>
<p><img src="/content/WhatsApp%20Image%202022-11-25%20at%2021.57.42.jpeg" /></p>
<div class="separator">
    
      Запощено в <a title="All pages tagged &#39;бабы&#39;." href="/tags/%D0%B1%D0%B0%D0%B1%D1%8B.html" rel="tag">бабы</a>
    
    <span class="disqus-comment-count" data-disqus-identifier="posts/ural.md"></span>
</div>
]]></summary>
</entry>
<entry>
    <title>не поэт</title>
    <link href="https://p0n4ik008.github.io/posts/library.html" />
    <id>https://p0n4ik008.github.io/posts/library.html</id>
    <published>25.11.2022</published>
    <updated>2022-11-25T00:00:00Z</updated>
    <summary type="html"><![CDATA[<p>
<a href="/posts/library.html">не поэт</a><br />
25 ноября 2022

</p>
<p><img src="/content/WhatsApp%20Image%202022-11-25%20at%2021.57.56.jpeg" /></p>
<div class="separator">
    
      Запощено в <a title="All pages tagged &#39;сэкс&#39;." href="/tags/%D1%81%D1%8D%D0%BA%D1%81.html" rel="tag">сэкс</a>
    
    <span class="disqus-comment-count" data-disqus-identifier="posts/library.md"></span>
</div>
]]></summary>
</entry>
<entry>
    <title>уравнение с тремя неизвестными</title>
    <link href="https://p0n4ik008.github.io/posts/matematik.html" />
    <id>https://p0n4ik008.github.io/posts/matematik.html</id>
    <published>05.11.2022</published>
    <updated>2022-11-05T00:00:00Z</updated>
    <summary type="html"><![CDATA[<p>
<a href="/posts/matematik.html">уравнение с тремя неизвестными</a><br />
 5 ноября 2022

</p>
<p><img src="/content/WhatsApp%20Image%202022-11-05%20at%2021.48.42.jpeg" /></p>
<div class="separator">
    
      Запощено в <a title="All pages tagged &#39;сэкс&#39;." href="/tags/%D1%81%D1%8D%D0%BA%D1%81.html" rel="tag">сэкс</a>
    
    <span class="disqus-comment-count" data-disqus-identifier="posts/matematik.md"></span>
</div>
]]></summary>
</entry>
<entry>
    <title>шарики для мышки</title>
    <link href="https://p0n4ik008.github.io/posts/balls.html" />
    <id>https://p0n4ik008.github.io/posts/balls.html</id>
    <published>17.09.2022</published>
    <updated>2022-09-17T00:00:00Z</updated>
    <summary type="html"><![CDATA[<p>
<a href="/posts/balls.html">шарики для мышки</a><br />
17 сентября 2022

</p>
<blockquote>
<p>За шариками надо следить постоянно, иногда их вынимают и уносят. Не знаю зачем, но в те времена такая проблема была, и админ при уходе клиента обязательно переворачивал мышь.</p>
</blockquote>
<blockquote>
<p>Ну для этого их и прячут в попку, но появилась другая проблема, сфинктер в время пукания разжимается и все <a href="https://pikabu.ru/story/pochemu_sosedi_sverkhu_ronyayut_i_katayut_metallicheskie_shariki_4978860">соседи слышат как эти шарики по полу катаются</a></p>
</blockquote>
<div class="separator">
    
      Запощено в <a title="All pages tagged &#39;цитаты&#39;." href="/tags/%D1%86%D0%B8%D1%82%D0%B0%D1%82%D1%8B.html" rel="tag">цитаты</a>
    
    <span class="disqus-comment-count" data-disqus-identifier="posts/balls.md"></span>
</div>
]]></summary>
</entry>
<entry>
    <title>жёлтые тюльпаны</title>
    <link href="https://p0n4ik008.github.io/posts/tulips.html" />
    <id>https://p0n4ik008.github.io/posts/tulips.html</id>
    <published>26.08.2022</published>
    <updated>2022-08-26T00:00:00Z</updated>
    <summary type="html"><![CDATA[<p>
<a href="/posts/tulips.html">жёлтые тюльпаны</a><br />
26 августа 2022

</p>
<p><span class="math inline"><video controls>
<source src="/content/WhatsApp Video 2022-08-26 at 08.12.03.mp4" preload="metadata">
</video>
</span></p>
<div class="separator">
    
      Запощено в <a title="All pages tagged &#39;сэкс&#39;." href="/tags/%D1%81%D1%8D%D0%BA%D1%81.html" rel="tag">сэкс</a>
    
    <span class="disqus-comment-count" data-disqus-identifier="posts/tulips.md"></span>
</div>
]]></summary>
</entry>
<entry>
    <title>скуби ду</title>
    <link href="https://p0n4ik008.github.io/posts/scubby.html" />
    <id>https://p0n4ik008.github.io/posts/scubby.html</id>
    <published>24.07.2022</published>
    <updated>2022-07-24T00:00:00Z</updated>
    <summary type="html"><![CDATA[<p>
<a href="/posts/scubby.html">скуби ду</a><br />
24 июля 2022

</p>
<p><img src="../content/cd96a4a2b102ec7ad211f6a0148fd70182693573.jpg" title="" alt="" width="645"></p>
<div class="separator">
    
      Запощено в <a title="All pages tagged &#39;бабы&#39;." href="/tags/%D0%B1%D0%B0%D0%B1%D1%8B.html" rel="tag">бабы</a>
    
    <span class="disqus-comment-count" data-disqus-identifier="posts/scubby.md"></span>
</div>
]]></summary>
</entry>
<entry>
    <title>Операция Ы!</title>
    <link href="https://p0n4ik008.github.io/posts/operation.html" />
    <id>https://p0n4ik008.github.io/posts/operation.html</id>
    <published>08.07.2022</published>
    <updated>2022-07-08T00:00:00Z</updated>
    <summary type="html"><![CDATA[<p>
<a href="/posts/operation.html">Операция Ы!</a><br />
 8 июля 2022

</p>
<p><img src="/content/WhatsApp%20Image%202022-07-08%20at%2018.59.27.jpeg" /></p>
<div class="separator">
    
      Запощено в <a title="All pages tagged &#39;сэкс&#39;." href="/tags/%D1%81%D1%8D%D0%BA%D1%81.html" rel="tag">сэкс</a>
    
    <span class="disqus-comment-count" data-disqus-identifier="posts/operation.md"></span>
</div>
]]></summary>
</entry>
<entry>
    <title>белый лебедь</title>
    <link href="https://p0n4ik008.github.io/posts/swan.html" />
    <id>https://p0n4ik008.github.io/posts/swan.html</id>
    <published>04.07.2022</published>
    <updated>2022-07-04T00:00:00Z</updated>
    <summary type="html"><![CDATA[<p>
<a href="/posts/swan.html">белый лебедь</a><br />
 4 июля 2022

</p>
<p><img src="/content/WhatsApp%20Image%202022-07-04%20at%2015.14.36.jpeg" /></p>
<div class="separator">
    
      Запощено в <a title="All pages tagged &#39;бабы&#39;." href="/tags/%D0%B1%D0%B0%D0%B1%D1%8B.html" rel="tag">бабы</a>
    
    <span class="disqus-comment-count" data-disqus-identifier="posts/swan.md"></span>
</div>
]]></summary>
</entry>
<entry>
    <title>Мир, труд, май!</title>
    <link href="https://p0n4ik008.github.io/posts/1may.html" />
    <id>https://p0n4ik008.github.io/posts/1may.html</id>
    <published>01.05.2022</published>
    <updated>2022-05-01T00:00:00Z</updated>
    <summary type="html"><![CDATA[<p>
<a href="/posts/1may.html">Мир, труд, май!</a><br />
 1 мая 2022

</p>
<p><img src="../content/WhatsApp%20Image%202022-05-04%20at%2012.01.49.jpeg" width="742" /></p>
<div class="separator">
    
      Запощено в <a title="All pages tagged &#39;сэкс&#39;." href="/tags/%D1%81%D1%8D%D0%BA%D1%81.html" rel="tag">сэкс</a>
    
    <span class="disqus-comment-count" data-disqus-identifier="posts/1may.md"></span>
</div>
]]></summary>
</entry>
<entry>
    <title>дары моря</title>
    <link href="https://p0n4ik008.github.io/posts/sea.html" />
    <id>https://p0n4ik008.github.io/posts/sea.html</id>
    <published>11.04.2022</published>
    <updated>2022-04-11T00:00:00Z</updated>
    <summary type="html"><![CDATA[<p>
<a href="/posts/sea.html">дары моря</a><br />
11 апреля 2022

</p>
<p><img src="../content/WhatsApp%20Image%202022-04-11%20at%2021.05.21.jpeg" /></p>
<div class="separator">
    
      Запощено в <a title="All pages tagged &#39;бабы&#39;." href="/tags/%D0%B1%D0%B0%D0%B1%D1%8B.html" rel="tag">бабы</a>
    
    <span class="disqus-comment-count" data-disqus-identifier="posts/sea.md"></span>
</div>
]]></summary>
</entry>
<entry>
    <title>Пикачу</title>
    <link href="https://p0n4ik008.github.io/posts/pika.html" />
    <id>https://p0n4ik008.github.io/posts/pika.html</id>
    <published>02.03.2022</published>
    <updated>2022-03-02T00:00:00Z</updated>
    <summary type="html"><![CDATA[<p>
<a href="/posts/pika.html">Пикачу</a><br />
 2 марта 2022

</p>
<p><img src="../content/245094741_335517035016148_8082059812848021152_n.jpg" /></p>
<div class="separator">
    
      Запощено в <a title="All pages tagged &#39;бабы&#39;." href="/tags/%D0%B1%D0%B0%D0%B1%D1%8B.html" rel="tag">бабы</a>
    
    <span class="disqus-comment-count" data-disqus-identifier="posts/pika.md"></span>
</div>
]]></summary>
</entry>
<entry>
    <title>С 23 февраля!</title>
    <link href="https://p0n4ik008.github.io/posts/23.html" />
    <id>https://p0n4ik008.github.io/posts/23.html</id>
    <published>23.02.2022</published>
    <updated>2022-02-23T00:00:00Z</updated>
    <summary type="html"><![CDATA[<p>
<a href="/posts/23.html">С 23 февраля!</a><br />
23 февраля 2022

</p>
<p><img src="../content/WhatsApp%20Image%202022-02-22%20at%2016.26.33.jpeg" /></p>
<div class="separator">
    
      Запощено в <a title="All pages tagged &#39;бабы&#39;." href="/tags/%D0%B1%D0%B0%D0%B1%D1%8B.html" rel="tag">бабы</a>
    
    <span class="disqus-comment-count" data-disqus-identifier="posts/23.md"></span>
</div>
]]></summary>
</entry>
<entry>
    <title>С пятницей!</title>
    <link href="https://p0n4ik008.github.io/posts/friday2.html" />
    <id>https://p0n4ik008.github.io/posts/friday2.html</id>
    <published>04.02.2022</published>
    <updated>2022-02-04T00:00:00Z</updated>
    <summary type="html"><![CDATA[<p>
<a href="/posts/friday2.html">С пятницей!</a><br />
 4 февраля 2022

</p>
<figure>
<img src="../content/5b4c9ef9bf5b38ad3bd5c2f0ba2c4774.png" alt="5b4c9ef9bf5b38ad3bd5c2f0ba2c4774.png" />
<figcaption aria-hidden="true">5b4c9ef9bf5b38ad3bd5c2f0ba2c4774.png</figcaption>
</figure>
<div class="separator">
    
      Запощено в <a title="All pages tagged &#39;бабы&#39;." href="/tags/%D0%B1%D0%B0%D0%B1%D1%8B.html" rel="tag">бабы</a>
    
    <span class="disqus-comment-count" data-disqus-identifier="posts/friday2.md"></span>
</div>
]]></summary>
</entry>
<entry>
    <title>С Новым Годом!</title>
    <link href="https://p0n4ik008.github.io/posts/newyear.html" />
    <id>https://p0n4ik008.github.io/posts/newyear.html</id>
    <published>31.12.2021</published>
    <updated>2021-12-31T00:00:00Z</updated>
    <summary type="html"><![CDATA[<p>
<a href="/posts/newyear.html">С Новым Годом!</a><br />
31 декабря 2021

</p>
<p><span class="math inline">

<a href="/gallery/newyear/WhatsApp%20Image%202021-12-22%20at%2009.12.00.jpeg.html"><img src="/gallery/newyear/WhatsApp%20Image%202021-12-22%20at%2009.12.00.thumb.jpeg"/></a>
<link rel="prefetch" href="/gallery/newyear/WhatsApp%20Image%202021-12-22%20at%2009.12.00.jpeg">



<a href="/gallery/newyear/WhatsApp%20Image%202021-12-28%20at%2008.22.21.jpeg.html"><img src="/gallery/newyear/WhatsApp%20Image%202021-12-28%20at%2008.22.21.thumb.jpeg"/></a>
<link rel="prefetch" href="/gallery/newyear/WhatsApp%20Image%202021-12-28%20at%2008.22.21.jpeg">



<a href="/gallery/newyear/WhatsApp%20Image%202021-12-31%20at%2021.38.10.jpeg.html"><img src="/gallery/newyear/WhatsApp%20Image%202021-12-31%20at%2021.38.10.thumb.jpeg"/></a>
<link rel="prefetch" href="/gallery/newyear/WhatsApp%20Image%202021-12-31%20at%2021.38.10.jpeg">



<a href="/gallery/newyear/WhatsApp%20Image%202021-12-31%20at%2021.38.42%20%281%29.jpeg.html"><img src="/gallery/newyear/WhatsApp%20Image%202021-12-31%20at%2021.38.42%20%281%29.thumb.jpeg"/></a>
<link rel="prefetch" href="/gallery/newyear/WhatsApp%20Image%202021-12-31%20at%2021.38.42%20%281%29.jpeg">



<a href="/gallery/newyear/WhatsApp%20Image%202021-12-31%20at%2021.38.42%20%282%29.jpeg.html"><img src="/gallery/newyear/WhatsApp%20Image%202021-12-31%20at%2021.38.42%20%282%29.thumb.jpeg"/></a>
<link rel="prefetch" href="/gallery/newyear/WhatsApp%20Image%202021-12-31%20at%2021.38.42%20%282%29.jpeg">



<a href="/gallery/newyear/WhatsApp%20Image%202021-12-31%20at%2021.38.42%20%283%29.jpeg.html"><img src="/gallery/newyear/WhatsApp%20Image%202021-12-31%20at%2021.38.42%20%283%29.thumb.jpeg"/></a>
<link rel="prefetch" href="/gallery/newyear/WhatsApp%20Image%202021-12-31%20at%2021.38.42%20%283%29.jpeg">



<a href="/gallery/newyear/WhatsApp%20Image%202021-12-31%20at%2021.38.42%20%284%29.jpeg.html"><img src="/gallery/newyear/WhatsApp%20Image%202021-12-31%20at%2021.38.42%20%284%29.thumb.jpeg"/></a>
<link rel="prefetch" href="/gallery/newyear/WhatsApp%20Image%202021-12-31%20at%2021.38.42%20%284%29.jpeg">



<a href="/gallery/newyear/WhatsApp%20Image%202021-12-31%20at%2021.38.42%20%285%29.jpeg.html"><img src="/gallery/newyear/WhatsApp%20Image%202021-12-31%20at%2021.38.42%20%285%29.thumb.jpeg"/></a>
<link rel="prefetch" href="/gallery/newyear/WhatsApp%20Image%202021-12-31%20at%2021.38.42%20%285%29.jpeg">



<a href="/gallery/newyear/WhatsApp%20Image%202021-12-31%20at%2021.38.42%20%286%29.jpeg.html"><img src="/gallery/newyear/WhatsApp%20Image%202021-12-31%20at%2021.38.42%20%286%29.thumb.jpeg"/></a>
<link rel="prefetch" href="/gallery/newyear/WhatsApp%20Image%202021-12-31%20at%2021.38.42%20%286%29.jpeg">



<a href="/gallery/newyear/WhatsApp%20Image%202021-12-31%20at%2021.38.42%20%287%29.jpeg.html"><img src="/gallery/newyear/WhatsApp%20Image%202021-12-31%20at%2021.38.42%20%287%29.thumb.jpeg"/></a>
<link rel="prefetch" href="/gallery/newyear/WhatsApp%20Image%202021-12-31%20at%2021.38.42%20%287%29.jpeg">



<a href="/gallery/newyear/WhatsApp%20Image%202021-12-31%20at%2021.38.42%20%288%29.jpeg.html"><img src="/gallery/newyear/WhatsApp%20Image%202021-12-31%20at%2021.38.42%20%288%29.thumb.jpeg"/></a>
<link rel="prefetch" href="/gallery/newyear/WhatsApp%20Image%202021-12-31%20at%2021.38.42%20%288%29.jpeg">



<a href="/gallery/newyear/WhatsApp%20Image%202021-12-31%20at%2021.38.42%20%289%29.jpeg.html"><img src="/gallery/newyear/WhatsApp%20Image%202021-12-31%20at%2021.38.42%20%289%29.thumb.jpeg"/></a>
<link rel="prefetch" href="/gallery/newyear/WhatsApp%20Image%202021-12-31%20at%2021.38.42%20%289%29.jpeg">



<a href="/gallery/newyear/WhatsApp%20Image%202021-12-31%20at%2021.38.42%20%2810%29.jpeg.html"><img src="/gallery/newyear/WhatsApp%20Image%202021-12-31%20at%2021.38.42%20%2810%29.thumb.jpeg"/></a>
<link rel="prefetch" href="/gallery/newyear/WhatsApp%20Image%202021-12-31%20at%2021.38.42%20%2810%29.jpeg">



<a href="/gallery/newyear/WhatsApp%20Image%202021-12-31%20at%2021.38.42%20%2811%29.jpeg.html"><img src="/gallery/newyear/WhatsApp%20Image%202021-12-31%20at%2021.38.42%20%2811%29.thumb.jpeg"/></a>
<link rel="prefetch" href="/gallery/newyear/WhatsApp%20Image%202021-12-31%20at%2021.38.42%20%2811%29.jpeg">



<a href="/gallery/newyear/WhatsApp%20Image%202021-12-31%20at%2021.38.42%20%2812%29.jpeg.html"><img src="/gallery/newyear/WhatsApp%20Image%202021-12-31%20at%2021.38.42%20%2812%29.thumb.jpeg"/></a>
<link rel="prefetch" href="/gallery/newyear/WhatsApp%20Image%202021-12-31%20at%2021.38.42%20%2812%29.jpeg">



<a href="/gallery/newyear/WhatsApp%20Image%202021-12-31%20at%2021.38.42%20%2813%29.jpeg.html"><img src="/gallery/newyear/WhatsApp%20Image%202021-12-31%20at%2021.38.42%20%2813%29.thumb.jpeg"/></a>
<link rel="prefetch" href="/gallery/newyear/WhatsApp%20Image%202021-12-31%20at%2021.38.42%20%2813%29.jpeg">



<a href="/gallery/newyear/WhatsApp%20Image%202021-12-31%20at%2021.38.42%20%2814%29.jpeg.html"><img src="/gallery/newyear/WhatsApp%20Image%202021-12-31%20at%2021.38.42%20%2814%29.thumb.jpeg"/></a>
<link rel="prefetch" href="/gallery/newyear/WhatsApp%20Image%202021-12-31%20at%2021.38.42%20%2814%29.jpeg">



<a href="/gallery/newyear/WhatsApp%20Image%202021-12-31%20at%2021.38.42.jpeg.html"><img src="/gallery/newyear/WhatsApp%20Image%202021-12-31%20at%2021.38.42.thumb.jpeg"/></a>
<link rel="prefetch" href="/gallery/newyear/WhatsApp%20Image%202021-12-31%20at%2021.38.42.jpeg">



<a href="/gallery/newyear/WhatsApp%20Image%202022-01-02%20at%2019.17.48.jpeg.html"><img src="/gallery/newyear/WhatsApp%20Image%202022-01-02%20at%2019.17.48.thumb.jpeg"/></a>
<link rel="prefetch" href="/gallery/newyear/WhatsApp%20Image%202022-01-02%20at%2019.17.48.jpeg">


</span></p>
<div class="separator">
    
      Запощено в <a title="All pages tagged &#39;бабы&#39;." href="/tags/%D0%B1%D0%B0%D0%B1%D1%8B.html" rel="tag">бабы</a>, <a title="All pages tagged &#39;сэкс&#39;." href="/tags/%D1%81%D1%8D%D0%BA%D1%81.html" rel="tag">сэкс</a>
    
    <span class="disqus-comment-count" data-disqus-identifier="posts/newyear.md"></span>
</div>
]]></summary>
</entry>
<entry>
    <title>весёлая молочница</title>
    <link href="https://p0n4ik008.github.io/posts/milk.html" />
    <id>https://p0n4ik008.github.io/posts/milk.html</id>
    <published>30.12.2021</published>
    <updated>2021-12-30T00:00:00Z</updated>
    <summary type="html"><![CDATA[<p>
<a href="/posts/milk.html">весёлая молочница</a><br />
30 декабря 2021

</p>
<p><span class="math inline"><video controls>
<source src="/content/30.12.mp4" preload="metadata">
</video>
</span></p>
<div class="separator">
    
      Запощено в <a title="All pages tagged &#39;сэкс&#39;." href="/tags/%D1%81%D1%8D%D0%BA%D1%81.html" rel="tag">сэкс</a>
    
    <span class="disqus-comment-count" data-disqus-identifier="posts/milk.md"></span>
</div>
]]></summary>
</entry>
<entry>
    <title>твой рот всегда этого ждал</title>
    <link href="https://p0n4ik008.github.io/posts/rot2.html" />
    <id>https://p0n4ik008.github.io/posts/rot2.html</id>
    <published>27.12.2021</published>
    <updated>2021-12-27T00:00:00Z</updated>
    <summary type="html"><![CDATA[<p>
<a href="/posts/rot2.html">твой рот всегда этого ждал</a><br />
27 декабря 2021

</p>
<p><span class="math inline"><video controls>
<source src="/content/27.12 (2).mp4" preload="metadata">
</video>
</span></p>
<div class="separator">
    
      Запощено в <a title="All pages tagged &#39;сэкс&#39;." href="/tags/%D1%81%D1%8D%D0%BA%D1%81.html" rel="tag">сэкс</a>
    
    <span class="disqus-comment-count" data-disqus-identifier="posts/rot2.md"></span>
</div>
]]></summary>
</entry>
<entry>
    <title>Любезный попутчик</title>
    <link href="https://p0n4ik008.github.io/posts/bike2.html" />
    <id>https://p0n4ik008.github.io/posts/bike2.html</id>
    <published>28.11.2021</published>
    <updated>2021-11-28T00:00:00Z</updated>
    <summary type="html"><![CDATA[<p>
<a href="/posts/bike2.html">Любезный попутчик</a><br />
28 ноября 2021

</p>
<p><span class="math inline"><video controls>
<source src="../content/videoplayback.mp4" preload="metadata">
</video>
</span></p>
<div class="separator">
    
      Запощено в <a title="All pages tagged &#39;бабы&#39;." href="/tags/%D0%B1%D0%B0%D0%B1%D1%8B.html" rel="tag">бабы</a>
    
    <span class="disqus-comment-count" data-disqus-identifier="posts/bike2.md"></span>
</div>
]]></summary>
</entry>
<entry>
    <title>Лайфхак при настройке интимного места</title>
    <link href="https://p0n4ik008.github.io/posts/g.html" />
    <id>https://p0n4ik008.github.io/posts/g.html</id>
    <published>29.10.2021</published>
    <updated>2021-10-29T00:00:00Z</updated>
    <summary type="html"><![CDATA[<p>
<a href="/posts/g.html">Лайфхак при настройке интимного места</a><br />
29 октября 2021

</p>
<p><img src="../content/WhatsApp%20Image%202021-10-29%20at%2017.38.19.jpeg" width="742" /></p>
<div class="separator">
    
      Запощено в <a title="All pages tagged &#39;сэкс&#39;." href="/tags/%D1%81%D1%8D%D0%BA%D1%81.html" rel="tag">сэкс</a>
    
    <span class="disqus-comment-count" data-disqus-identifier="posts/g.md"></span>
</div>
]]></summary>
</entry>
<entry>
    <title>Спорт пончика</title>
    <link href="https://p0n4ik008.github.io/posts/p0n4ik.html" />
    <id>https://p0n4ik008.github.io/posts/p0n4ik.html</id>
    <published>12.10.2021</published>
    <updated>2021-10-12T00:00:00Z</updated>
    <summary type="html"><![CDATA[<p>
<a href="/posts/p0n4ik.html">Спорт пончика</a><br />
12 октября 2021

</p>
<p><img src="../content/WhatsApp%20Image%202021-10-12%20at%2014.04.15.jpeg" width="742" /></p>
<div class="separator">
    
      Запощено в <a title="All pages tagged &#39;пончики&#39;." href="/tags/%D0%BF%D0%BE%D0%BD%D1%87%D0%B8%D0%BA%D0%B8.html" rel="tag">пончики</a>
    
    <span class="disqus-comment-count" data-disqus-identifier="posts/p0n4ik.md"></span>
</div>
]]></summary>
</entry>
<entry>
    <title>Правильный допрос</title>
    <link href="https://p0n4ik008.github.io/posts/prostitutka.html" />
    <id>https://p0n4ik008.github.io/posts/prostitutka.html</id>
    <published>10.10.2021</published>
    <updated>2021-10-10T00:00:00Z</updated>
    <summary type="html"><![CDATA[<p>
<a href="/posts/prostitutka.html">Правильный допрос</a><br />
10 октября 2021

</p>
<p><span class="math inline"><video controls>
<source src="../content/241975786_242903657757287_5240313432338739773_n.mp4" preload="metadata">
</video>
</span></p>
<div class="separator">
    
      Запощено в <a title="All pages tagged &#39;бабы&#39;." href="/tags/%D0%B1%D0%B0%D0%B1%D1%8B.html" rel="tag">бабы</a>
    
    <span class="disqus-comment-count" data-disqus-identifier="posts/prostitutka.md"></span>
</div>
]]></summary>
</entry>
<entry>
    <title>Житейские мудрости</title>
    <link href="https://p0n4ik008.github.io/posts/babes.html" />
    <id>https://p0n4ik008.github.io/posts/babes.html</id>
    <published>05.10.2021</published>
    <updated>2021-10-05T00:00:00Z</updated>
    <summary type="html"><![CDATA[<p>
<a href="/posts/babes.html">Житейские мудрости</a><br />
 5 октября 2021

</p>
<figure>
<img src="../content/WhatsApp%20Image%202021-10-05%20at%2012.55.27%20(2).jpeg" alt="WhatsApp Image 2021-10-05 at 12.55.27 (2)" />
<figcaption aria-hidden="true">WhatsApp Image 2021-10-05 at 12.55.27 (2)</figcaption>
</figure>
<figure>
<img src="../content/WhatsApp%20Image%202021-10-05%20at%2012.55.27%20(3).jpeg" alt="WhatsApp Image 2021-10-05 at 12.55.27 (3)" />
<figcaption aria-hidden="true">WhatsApp Image 2021-10-05 at 12.55.27 (3)</figcaption>
</figure>
<figure>
<img src="../content/WhatsApp%20Image%202021-10-05%20at%2012.55.28.jpeg" alt="WhatsApp Image 2021-10-05 at 12.55.28" />
<figcaption aria-hidden="true">WhatsApp Image 2021-10-05 at 12.55.28</figcaption>
</figure>
<figure>
<img src="../content/WhatsApp%20Image%202021-10-05%20at%2012.55.26%20(1).jpeg" alt="WhatsApp Image 2021-10-05 at 12.55.26 (1)" />
<figcaption aria-hidden="true">WhatsApp Image 2021-10-05 at 12.55.26 (1)</figcaption>
</figure>
<figure>
<img src="../content/WhatsApp%20Image%202021-10-05%20at%2012.55.26%20(2).jpeg" alt="WhatsApp Image 2021-10-05 at 12.55.26 (2)" />
<figcaption aria-hidden="true">WhatsApp Image 2021-10-05 at 12.55.26 (2)</figcaption>
</figure>
<figure>
<img src="../content/WhatsApp%20Image%202021-10-05%20at%2012.55.26%20(3).jpeg" alt="WhatsApp Image 2021-10-05 at 12.55.26 (3)" />
<figcaption aria-hidden="true">WhatsApp Image 2021-10-05 at 12.55.26 (3)</figcaption>
</figure>
<figure>
<img src="../content/WhatsApp%20Image%202021-10-05%20at%2012.55.27.jpeg" alt="WhatsApp Image 2021-10-05 at 12.55.27" />
<figcaption aria-hidden="true">WhatsApp Image 2021-10-05 at 12.55.27</figcaption>
</figure>
<figure>
<img src="../content/WhatsApp%20Image%202021-10-05%20at%2012.55.27%20(1).jpeg" alt="WhatsApp Image 2021-10-05 at 12.55.27 (1)" />
<figcaption aria-hidden="true">WhatsApp Image 2021-10-05 at 12.55.27 (1)</figcaption>
</figure>
<figure>
<img src="../content/WhatsApp%20Image%202021-10-05%20at%2012.55.26.jpeg" alt="WhatsApp Image 2021-10-05 at 12.55.26" />
<figcaption aria-hidden="true">WhatsApp Image 2021-10-05 at 12.55.26</figcaption>
</figure>
<div class="separator">
    
      Запощено в <a title="All pages tagged &#39;бабы&#39;." href="/tags/%D0%B1%D0%B0%D0%B1%D1%8B.html" rel="tag">бабы</a>, <a title="All pages tagged &#39;сэкс&#39;." href="/tags/%D1%81%D1%8D%D0%BA%D1%81.html" rel="tag">сэкс</a>
    
    <span class="disqus-comment-count" data-disqus-identifier="posts/babes.md"></span>
</div>
]]></summary>
</entry>
<entry>
    <title>Жига</title>
    <link href="https://p0n4ik008.github.io/posts/vaz.html" />
    <id>https://p0n4ik008.github.io/posts/vaz.html</id>
    <published>11.09.2021</published>
    <updated>2021-09-11T00:00:00Z</updated>
    <summary type="html"><![CDATA[<p>
<a href="/posts/vaz.html">Жига</a><br />
11 сентября 2021

</p>
<p><span class="math inline"><video controls>
<source src="../content/238036976_245943047391991_5779785277881672487_n.mp4" preload="metadata">
</video>
</span></p>
<div class="separator">
    
      Запощено в <a title="All pages tagged &#39;бабы&#39;." href="/tags/%D0%B1%D0%B0%D0%B1%D1%8B.html" rel="tag">бабы</a>
    
    <span class="disqus-comment-count" data-disqus-identifier="posts/vaz.md"></span>
</div>
]]></summary>
</entry>
<entry>
    <title>три сиськи</title>
    <link href="https://p0n4ik008.github.io/posts/tri.html" />
    <id>https://p0n4ik008.github.io/posts/tri.html</id>
    <published>10.08.2021</published>
    <updated>2021-08-10T00:00:00Z</updated>
    <summary type="html"><![CDATA[<p>
<a href="/posts/tri.html">три сиськи</a><br />
10 августа 2021

</p>
<figure>
<img src="../content/WhatsApp%20Image%202021-08-10%20at%2016.22.28.jpeg" alt="WhatsApp Image 2021-08-10 at 16.22.28" />
<figcaption aria-hidden="true">WhatsApp Image 2021-08-10 at 16.22.28</figcaption>
</figure>
<div class="separator">
    
      Запощено в <a title="All pages tagged &#39;бабы&#39;." href="/tags/%D0%B1%D0%B0%D0%B1%D1%8B.html" rel="tag">бабы</a>
    
    <span class="disqus-comment-count" data-disqus-identifier="posts/tri.md"></span>
</div>
]]></summary>
</entry>
<entry>
    <title>бездорожье</title>
    <link href="https://p0n4ik008.github.io/posts/cross.html" />
    <id>https://p0n4ik008.github.io/posts/cross.html</id>
    <published>10.08.2021</published>
    <updated>2021-08-10T00:00:00Z</updated>
    <summary type="html"><![CDATA[<p>
<a href="/posts/cross.html">бездорожье</a><br />
10 августа 2021

</p>
<figure>
<img src="../content/WhatsApp%20Image%202021-08-10%20at%2016.22.15.jpeg" alt="WhatsApp Image 2021-08-10 at 16.22.15" />
<figcaption aria-hidden="true">WhatsApp Image 2021-08-10 at 16.22.15</figcaption>
</figure>
<div class="separator">
    
      Запощено в <a title="All pages tagged &#39;бабы&#39;." href="/tags/%D0%B1%D0%B0%D0%B1%D1%8B.html" rel="tag">бабы</a>
    
    <span class="disqus-comment-count" data-disqus-identifier="posts/cross.md"></span>
</div>
]]></summary>
</entry>
<entry>
    <title>малолетка за гаражами</title>
    <link href="https://p0n4ik008.github.io/posts/maloletka.html" />
    <id>https://p0n4ik008.github.io/posts/maloletka.html</id>
    <published>03.08.2021</published>
    <updated>2021-08-03T00:00:00Z</updated>
    <summary type="html"><![CDATA[<p>
<a href="/posts/maloletka.html">малолетка за гаражами</a><br />
 3 августа 2021

</p>
<figure>
<img src="../content/WhatsApp%20Image%202021-08-03%20at%2015.20.16.jpeg" alt="WhatsApp Image 2021-08-03 at 15.20.16" />
<figcaption aria-hidden="true">WhatsApp Image 2021-08-03 at 15.20.16</figcaption>
</figure>
<div class="separator">
    
      Запощено в <a title="All pages tagged &#39;бабы&#39;." href="/tags/%D0%B1%D0%B0%D0%B1%D1%8B.html" rel="tag">бабы</a>
    
    <span class="disqus-comment-count" data-disqus-identifier="posts/maloletka.md"></span>
</div>
]]></summary>
</entry>
<entry>
    <title>новый вид олимпиады</title>
    <link href="https://p0n4ik008.github.io/posts/seks.html" />
    <id>https://p0n4ik008.github.io/posts/seks.html</id>
    <published>31.07.2021</published>
    <updated>2021-07-31T00:00:00Z</updated>
    <summary type="html"><![CDATA[<p>
<a href="/posts/seks.html">новый вид олимпиады</a><br />
31 июля 2021

</p>
<p><span class="math inline"><video controls>
<source src="/content/seks.mp4" preload="metadata">
</video>
</span></p>
<div class="separator">
    
      Запощено в <a title="All pages tagged &#39;сэкс&#39;." href="/tags/%D1%81%D1%8D%D0%BA%D1%81.html" rel="tag">сэкс</a>
    
    <span class="disqus-comment-count" data-disqus-identifier="posts/seks.md"></span>
</div>
]]></summary>
</entry>
<entry>
    <title>Искуственный интеллект</title>
    <link href="https://p0n4ik008.github.io/posts/intellect.html" />
    <id>https://p0n4ik008.github.io/posts/intellect.html</id>
    <published>30.07.2021</published>
    <updated>2021-07-30T00:00:00Z</updated>
    <summary type="html"><![CDATA[<p>
<a href="/posts/intellect.html">Искуственный интеллект</a><br />
30 июля 2021

</p>
<figure>
<img src="../content/WhatsApp%20Image%202021-07-30%20at%2023.08.27.jpeg" alt="WhatsApp Image 2021-07-30 at 23.08.27" />
<figcaption aria-hidden="true">WhatsApp Image 2021-07-30 at 23.08.27</figcaption>
</figure>
<div class="separator">
    
      Запощено в <a title="All pages tagged &#39;сэкс&#39;." href="/tags/%D1%81%D1%8D%D0%BA%D1%81.html" rel="tag">сэкс</a>
    
    <span class="disqus-comment-count" data-disqus-identifier="posts/intellect.md"></span>
</div>
]]></summary>
</entry>
<entry>
    <title>сладкая дырочка</title>
    <link href="https://p0n4ik008.github.io/posts/ochko.html" />
    <id>https://p0n4ik008.github.io/posts/ochko.html</id>
    <published>24.07.2021</published>
    <updated>2021-07-24T00:00:00Z</updated>
    <summary type="html"><![CDATA[<p>
<a href="/posts/ochko.html">сладкая дырочка</a><br />
24 июля 2021

</p>
<p><img src="../content/193292317_1627617674264648_7273243702907832089_n.jpg" width="742" /></p>
<div class="separator">
    
      Запощено в <a title="All pages tagged &#39;бабы&#39;." href="/tags/%D0%B1%D0%B0%D0%B1%D1%8B.html" rel="tag">бабы</a>
    
    <span class="disqus-comment-count" data-disqus-identifier="posts/ochko.md"></span>
</div>
]]></summary>
</entry>
<entry>
    <title>красота</title>
    <link href="https://p0n4ik008.github.io/posts/oral2.html" />
    <id>https://p0n4ik008.github.io/posts/oral2.html</id>
    <published>15.07.2021</published>
    <updated>2021-07-15T00:00:00Z</updated>
    <summary type="html"><![CDATA[<p>
<a href="/posts/oral2.html">красота</a><br />
15 июля 2021

</p>
<p><span class="math inline"><video controls>
<source src="/content/WhatsApp Video 2021-07-15 at 20.01.53.mp4" preload="metadata">
</video>
</span></p>
<div class="separator">
    
      Запощено в <a title="All pages tagged &#39;сэкс&#39;." href="/tags/%D1%81%D1%8D%D0%BA%D1%81.html" rel="tag">сэкс</a>
    
    <span class="disqus-comment-count" data-disqus-identifier="posts/oral2.md"></span>
</div>
]]></summary>
</entry>
<entry>
    <title>грация кошки</title>
    <link href="https://p0n4ik008.github.io/posts/koshka.html" />
    <id>https://p0n4ik008.github.io/posts/koshka.html</id>
    <published>15.07.2021</published>
    <updated>2021-07-15T00:00:00Z</updated>
    <summary type="html"><![CDATA[<p>
<a href="/posts/koshka.html">грация кошки</a><br />
15 июля 2021

</p>
<p><span class="math inline"><video controls>
<source src="/content/WhatsApp Video 2021-07-15 at 20.01.12.mp4" preload="metadata">
</video>
</span></p>
<div class="separator">
    
      Запощено в <a title="All pages tagged &#39;бабы&#39;." href="/tags/%D0%B1%D0%B0%D0%B1%D1%8B.html" rel="tag">бабы</a>
    
    <span class="disqus-comment-count" data-disqus-identifier="posts/koshka.md"></span>
</div>
]]></summary>
</entry>
<entry>
    <title>непростое украшение</title>
    <link href="https://p0n4ik008.github.io/posts/urkashenie.html" />
    <id>https://p0n4ik008.github.io/posts/urkashenie.html</id>
    <published>29.06.2021</published>
    <updated>2021-06-29T00:00:00Z</updated>
    <summary type="html"><![CDATA[<p>
<a href="/posts/urkashenie.html">непростое украшение</a><br />
29 июня 2021

</p>
<p><span class="math inline"><video controls>
<source src="/content/WhatsApp Video 2021-06-29 at 19.18.35.mp4" preload="metadata">
</video>
</span></p>
<div class="separator">
    
      Запощено в <a title="All pages tagged &#39;сэкс&#39;." href="/tags/%D1%81%D1%8D%D0%BA%D1%81.html" rel="tag">сэкс</a>
    
    <span class="disqus-comment-count" data-disqus-identifier="posts/urkashenie.md"></span>
</div>
]]></summary>
</entry>
<entry>
    <title>туда тоже можно</title>
    <link href="https://p0n4ik008.github.io/posts/vhod.html" />
    <id>https://p0n4ik008.github.io/posts/vhod.html</id>
    <published>12.06.2021</published>
    <updated>2021-06-12T00:00:00Z</updated>
    <summary type="html"><![CDATA[<p>
<a href="/posts/vhod.html">туда тоже можно</a><br />
12 июня 2021

</p>
<p><span class="math inline"><video controls>
<source src="/content/WhatsApp Video 2021-06-12 at 09.16.59.mp4" preload="metadata">
</video>
</span></p>
<div class="separator">
    
      Запощено в <a title="All pages tagged &#39;сэкс&#39;." href="/tags/%D1%81%D1%8D%D0%BA%D1%81.html" rel="tag">сэкс</a>
    
    <span class="disqus-comment-count" data-disqus-identifier="posts/vhod.md"></span>
</div>
]]></summary>
</entry>
<entry>
    <title>со вкусом не угадали</title>
    <link href="https://p0n4ik008.github.io/posts/cock.html" />
    <id>https://p0n4ik008.github.io/posts/cock.html</id>
    <published>04.06.2021</published>
    <updated>2021-06-04T00:00:00Z</updated>
    <summary type="html"><![CDATA[<p>
<a href="/posts/cock.html">со вкусом не угадали</a><br />
 4 июня 2021

</p>
<p>Лица не особо радостные, видимо со вкусом не угадали</p>
<p><span class="math inline"><video controls>
<source src="/content/WhatsApp Video 2021-06-04 at 22.08.12.mp4" preload="metadata">
</video>
</span></p>
<div class="separator">
    
      Запощено в <a title="All pages tagged &#39;сэкс&#39;." href="/tags/%D1%81%D1%8D%D0%BA%D1%81.html" rel="tag">сэкс</a>
    
    <span class="disqus-comment-count" data-disqus-identifier="posts/cock.md"></span>
</div>
]]></summary>
</entry>
<entry>
    <title>ни слова Андрейке</title>
    <link href="https://p0n4ik008.github.io/posts/andreyka.html" />
    <id>https://p0n4ik008.github.io/posts/andreyka.html</id>
    <published>31.05.2021</published>
    <updated>2021-05-31T00:00:00Z</updated>
    <summary type="html"><![CDATA[<p>
<a href="/posts/andreyka.html">ни слова Андрейке</a><br />
31 мая 2021

</p>
<p><span class="math inline"><video controls>
<source src="/content/WhatsApp Video 2021-05-31 at 21.29.10.mp4" preload="metadata">
</video>
</span></p>
<div class="separator">
    
      Запощено в <a title="All pages tagged &#39;сэкс&#39;." href="/tags/%D1%81%D1%8D%D0%BA%D1%81.html" rel="tag">сэкс</a>
    
    <span class="disqus-comment-count" data-disqus-identifier="posts/andreyka.md"></span>
</div>
]]></summary>
</entry>
<entry>
    <title>говотим блинчики</title>
    <link href="https://p0n4ik008.github.io/posts/pancakes.html" />
    <id>https://p0n4ik008.github.io/posts/pancakes.html</id>
    <published>08.05.2021</published>
    <updated>2021-05-08T00:00:00Z</updated>
    <summary type="html"><![CDATA[<p>
<a href="/posts/pancakes.html">говотим блинчики</a><br />
 8 мая 2021

</p>
<p><span class="math inline"><video controls>
<source src="/content/WhatsApp Video 2021-05-08 at 11.41.14.mp4" preload="metadata">
</video>
</span></p>
<div class="separator">
    
      Запощено в <a title="All pages tagged &#39;бабы&#39;." href="/tags/%D0%B1%D0%B0%D0%B1%D1%8B.html" rel="tag">бабы</a>
    
    <span class="disqus-comment-count" data-disqus-identifier="posts/pancakes.md"></span>
</div>
]]></summary>
</entry>
<entry>
    <title>как вы себя чувствуете?</title>
    <link href="https://p0n4ik008.github.io/posts/fizkult.html" />
    <id>https://p0n4ik008.github.io/posts/fizkult.html</id>
    <published>17.04.2021</published>
    <updated>2021-04-17T00:00:00Z</updated>
    <summary type="html"><![CDATA[<p>
<a href="/posts/fizkult.html">как вы себя чувствуете?</a><br />
17 апреля 2021

</p>
<p><span class="math inline"><video controls>
<source src="/content/WhatsApp Video 2021-04-17 at 09.20.59.mp4" preload="metadata">
</video>
</span></p>
<div class="separator">
    
      Запощено в <a title="All pages tagged &#39;сэкс&#39;." href="/tags/%D1%81%D1%8D%D0%BA%D1%81.html" rel="tag">сэкс</a>
    
    <span class="disqus-comment-count" data-disqus-identifier="posts/fizkult.md"></span>
</div>
]]></summary>
</entry>
<entry>
    <title>почистите мои трубы?</title>
    <link href="https://p0n4ik008.github.io/posts/pipes.html" />
    <id>https://p0n4ik008.github.io/posts/pipes.html</id>
    <published>15.04.2021</published>
    <updated>2021-04-15T00:00:00Z</updated>
    <summary type="html"><![CDATA[<p>
<a href="/posts/pipes.html">почистите мои трубы?</a><br />
15 апреля 2021

</p>
<p><span class="math inline"><video controls>
<source src="/content/6947642508524391681-nw.mp4" preload="metadata">
</video>
</span></p>
<div class="separator">
    
      Запощено в <a title="All pages tagged &#39;сэкс&#39;." href="/tags/%D1%81%D1%8D%D0%BA%D1%81.html" rel="tag">сэкс</a>
    
    <span class="disqus-comment-count" data-disqus-identifier="posts/pipes.md"></span>
</div>
]]></summary>
</entry>
<entry>
    <title>Балалаешница</title>
    <link href="https://p0n4ik008.github.io/posts/balalaika.html" />
    <id>https://p0n4ik008.github.io/posts/balalaika.html</id>
    <published>15.04.2021</published>
    <updated>2021-04-15T00:00:00Z</updated>
    <summary type="html"><![CDATA[<p>
<a href="/posts/balalaika.html">Балалаешница</a><br />
15 апреля 2021

</p>
<p><img src="../content/WhatsApp%20Image%202021-04-15%20at%2013.14.36.jpeg" width="742" /></p>
<div class="separator">
    
      Запощено в <a title="All pages tagged &#39;сэкс&#39;." href="/tags/%D1%81%D1%8D%D0%BA%D1%81.html" rel="tag">сэкс</a>
    
    <span class="disqus-comment-count" data-disqus-identifier="posts/balalaika.md"></span>
</div>
]]></summary>
</entry>
<entry>
    <title>Девочка подросла, а навыки пригодились</title>
    <link href="https://p0n4ik008.github.io/posts/horse2.html" />
    <id>https://p0n4ik008.github.io/posts/horse2.html</id>
    <published>10.04.2021</published>
    <updated>2021-04-10T00:00:00Z</updated>
    <summary type="html"><![CDATA[<p>
<a href="/posts/horse2.html">Девочка подросла, а навыки пригодились</a><br />
10 апреля 2021

</p>
<p><span class="math inline"><video controls>
<source src="../content/166234524_741837539810092_2695361577198401329_n.mp4" preload="metadata">
</video>
</span></p>
<div class="separator">
    
      Запощено в <a title="All pages tagged &#39;сэкс&#39;." href="/tags/%D1%81%D1%8D%D0%BA%D1%81.html" rel="tag">сэкс</a>
    
    <span class="disqus-comment-count" data-disqus-identifier="posts/horse2.md"></span>
</div>
]]></summary>
</entry>
<entry>
    <title>Некогда ухаживать</title>
    <link href="https://p0n4ik008.github.io/posts/delo.html" />
    <id>https://p0n4ik008.github.io/posts/delo.html</id>
    <published>03.04.2021</published>
    <updated>2021-04-03T00:00:00Z</updated>
    <summary type="html"><![CDATA[<p>
<a href="/posts/delo.html">Некогда ухаживать</a><br />
 3 апреля 2021

</p>
<p><span class="math inline"><video controls>
<source src="../content/WhatsApp Video 2021-04-03 at 18.44.17.mp4" preload="metadata">
</video>
</span></p>
<div class="separator">
    
      Запощено в <a title="All pages tagged &#39;сэкс&#39;." href="/tags/%D1%81%D1%8D%D0%BA%D1%81.html" rel="tag">сэкс</a>
    
    <span class="disqus-comment-count" data-disqus-identifier="posts/delo.md"></span>
</div>
]]></summary>
</entry>
<entry>
    <title>девушка с крокодилом</title>
    <link href="https://p0n4ik008.github.io/posts/krok.html" />
    <id>https://p0n4ik008.github.io/posts/krok.html</id>
    <published>01.04.2021</published>
    <updated>2021-04-01T00:00:00Z</updated>
    <summary type="html"><![CDATA[<p>
<a href="/posts/krok.html">девушка с крокодилом</a><br />
 1 апреля 2021

</p>
<p><img src="/content/photo_2021-04-01_23-01-49.jpg" width="742" /></p>
<div class="separator">
    
      Запощено в <a title="All pages tagged &#39;бабы&#39;." href="/tags/%D0%B1%D0%B0%D0%B1%D1%8B.html" rel="tag">бабы</a>
    
    <span class="disqus-comment-count" data-disqus-identifier="posts/krok.md"></span>
</div>
]]></summary>
</entry>
<entry>
    <title>Этого зайца боялись даже волки</title>
    <link href="https://p0n4ik008.github.io/posts/rabbit.html" />
    <id>https://p0n4ik008.github.io/posts/rabbit.html</id>
    <published>28.03.2021</published>
    <updated>2021-03-28T00:00:00Z</updated>
    <summary type="html"><![CDATA[<p>
<a href="/posts/rabbit.html">Этого зайца боялись даже волки</a><br />
28 марта 2021

</p>
<figure>
<img src="../content/WhatsApp%20Image%202021-03-28%20at%2015.55.31.jpeg" alt="WhatsApp Image 2021-03-28 at 15.55.31" />
<figcaption aria-hidden="true">WhatsApp Image 2021-03-28 at 15.55.31</figcaption>
</figure>
<div class="separator">
    
      Запощено в без рубрики
    
    <span class="disqus-comment-count" data-disqus-identifier="posts/rabbit.md"></span>
</div>
]]></summary>
</entry>
<entry>
    <title>Любите баб</title>
    <link href="https://p0n4ik008.github.io/posts/love.html" />
    <id>https://p0n4ik008.github.io/posts/love.html</id>
    <published>28.03.2021</published>
    <updated>2021-03-28T00:00:00Z</updated>
    <summary type="html"><![CDATA[<p>
<a href="/posts/love.html">Любите баб</a><br />
28 марта 2021

</p>
<p><img src="../content/WhatsApp%20Image%202021-03-28%20at%2015.37.22.jpeg" width="742" /></p>
<div class="separator">
    
      Запощено в <a title="All pages tagged &#39;сэкс&#39;." href="/tags/%D1%81%D1%8D%D0%BA%D1%81.html" rel="tag">сэкс</a>
    
    <span class="disqus-comment-count" data-disqus-identifier="posts/love.md"></span>
</div>
]]></summary>
</entry>
<entry>
    <title>Языковой барьер</title>
    <link href="https://p0n4ik008.github.io/posts/language.html" />
    <id>https://p0n4ik008.github.io/posts/language.html</id>
    <published>28.03.2021</published>
    <updated>2021-03-28T00:00:00Z</updated>
    <summary type="html"><![CDATA[<p>
<a href="/posts/language.html">Языковой барьер</a><br />
28 марта 2021

</p>
<p><span class="math inline"><video controls>
<source src="../content/WhatsApp Video 2021-03-28 at 15.47.00.mp4" preload="metadata">
</video>
</span></p>
<div class="separator">
    
      Запощено в <a title="All pages tagged &#39;оружие&#39;." href="/tags/%D0%BE%D1%80%D1%83%D0%B6%D0%B8%D0%B5.html" rel="tag">оружие</a>
    
    <span class="disqus-comment-count" data-disqus-identifier="posts/language.md"></span>
</div>
]]></summary>
</entry>
<entry>
    <title>Диско хиты</title>
    <link href="https://p0n4ik008.github.io/posts/disco.html" />
    <id>https://p0n4ik008.github.io/posts/disco.html</id>
    <published>28.03.2021</published>
    <updated>2021-03-28T00:00:00Z</updated>
    <summary type="html"><![CDATA[<p>
<a href="/posts/disco.html">Диско хиты</a><br />
28 марта 2021

</p>
<p><span class="math inline"><video controls>
<source src="../content/WhatsApp Video 2021-03-28 at 15.40.53.mp4" preload="metadata">
</video>
</span></p>
<div class="separator">
    
      Запощено в <a title="All pages tagged &#39;бабы&#39;." href="/tags/%D0%B1%D0%B0%D0%B1%D1%8B.html" rel="tag">бабы</a>, <a title="All pages tagged &#39;сэкс&#39;." href="/tags/%D1%81%D1%8D%D0%BA%D1%81.html" rel="tag">сэкс</a>
    
    <span class="disqus-comment-count" data-disqus-identifier="posts/disco.md"></span>
</div>
]]></summary>
</entry>
<entry>
    <title>Много общего</title>
    <link href="https://p0n4ik008.github.io/posts/rot.html" />
    <id>https://p0n4ik008.github.io/posts/rot.html</id>
    <published>12.03.2021</published>
    <updated>2021-03-12T00:00:00Z</updated>
    <summary type="html"><![CDATA[<p>
<a href="/posts/rot.html">Много общего</a><br />
12 марта 2021

</p>
<figure>
<img src="../content/WhatsApp%20Image%202021-03-12%20at%2017.07.17.jpeg" alt="WhatsApp Image 2021-03-12 at 17.07.17" />
<figcaption aria-hidden="true">WhatsApp Image 2021-03-12 at 17.07.17</figcaption>
</figure>
<div class="separator">
    
      Запощено в <a title="All pages tagged &#39;сэкс&#39;." href="/tags/%D1%81%D1%8D%D0%BA%D1%81.html" rel="tag">сэкс</a>
    
    <span class="disqus-comment-count" data-disqus-identifier="posts/rot.md"></span>
</div>
]]></summary>
</entry>
<entry>
    <title>Крокодилдо</title>
    <link href="https://p0n4ik008.github.io/posts/croc.html" />
    <id>https://p0n4ik008.github.io/posts/croc.html</id>
    <published>10.03.2021</published>
    <updated>2021-03-10T00:00:00Z</updated>
    <summary type="html"><![CDATA[<p>
<a href="/posts/croc.html">Крокодилдо</a><br />
10 марта 2021

</p>
<figure>
<img src="../content/WhatsApp%20Image%202021-03-10%20at%2006.54.21.jpeg" alt="WhatsApp Image 2021-03-10 at 06.54.21" />
<figcaption aria-hidden="true">WhatsApp Image 2021-03-10 at 06.54.21</figcaption>
</figure>
<div class="separator">
    
      Запощено в <a title="All pages tagged &#39;сэкс&#39;." href="/tags/%D1%81%D1%8D%D0%BA%D1%81.html" rel="tag">сэкс</a>
    
    <span class="disqus-comment-count" data-disqus-identifier="posts/croc.md"></span>
</div>
]]></summary>
</entry>
<entry>
    <title>Оружие россии</title>
    <link href="https://p0n4ik008.github.io/posts/weapons.html" />
    <id>https://p0n4ik008.github.io/posts/weapons.html</id>
    <published>09.03.2021</published>
    <updated>2021-03-09T00:00:00Z</updated>
    <summary type="html"><![CDATA[<p>
<a href="/posts/weapons.html">Оружие россии</a><br />
 9 марта 2021

</p>
<p><span class="math inline"><video controls>
<source src="/content/WhatsApp Video 2021-03-09 at 15.24.39.mp4" preload="metadata">
</video>
</span></p>
<div class="separator">
    
      Запощено в <a title="All pages tagged &#39;оружие&#39;." href="/tags/%D0%BE%D1%80%D1%83%D0%B6%D0%B8%D0%B5.html" rel="tag">оружие</a>
    
    <span class="disqus-comment-count" data-disqus-identifier="posts/weapons.md"></span>
</div>
]]></summary>
</entry>
<entry>
    <title>Любви все возрасты покорны</title>
    <link href="https://p0n4ik008.github.io/posts/students.html" />
    <id>https://p0n4ik008.github.io/posts/students.html</id>
    <published>09.03.2021</published>
    <updated>2021-03-09T00:00:00Z</updated>
    <summary type="html"><![CDATA[<p>
<a href="/posts/students.html">Любви все возрасты покорны</a><br />
 9 марта 2021

</p>
<figure>
<img src="../content/WhatsApp%20Image%202021-03-09%20at%2015.23.30.jpeg" alt="WhatsApp Image 2021-03-09 at 15.23.30" />
<figcaption aria-hidden="true">WhatsApp Image 2021-03-09 at 15.23.30</figcaption>
</figure>
<div class="separator">
    
      Запощено в <a title="All pages tagged &#39;бабы&#39;." href="/tags/%D0%B1%D0%B0%D0%B1%D1%8B.html" rel="tag">бабы</a>
    
    <span class="disqus-comment-count" data-disqus-identifier="posts/students.md"></span>
</div>
]]></summary>
</entry>
<entry>
    <title>Интересный клип</title>
    <link href="https://p0n4ik008.github.io/posts/interest.html" />
    <id>https://p0n4ik008.github.io/posts/interest.html</id>
    <published>09.03.2021</published>
    <updated>2021-03-09T00:00:00Z</updated>
    <summary type="html"><![CDATA[<p>
<a href="/posts/interest.html">Интересный клип</a><br />
 9 марта 2021

</p>
<p><span class="math inline"><video controls>
<source src="/content/WhatsApp Video 2021-03-09 at 18.52.22.mp4" preload="metadata">
</video>
</span></p>
<div class="separator">
    
      Запощено в <a title="All pages tagged &#39;бабы&#39;." href="/tags/%D0%B1%D0%B0%D0%B1%D1%8B.html" rel="tag">бабы</a>
    
    <span class="disqus-comment-count" data-disqus-identifier="posts/interest.md"></span>
</div>
]]></summary>
</entry>
<entry>
    <title>Армейские стандарты</title>
    <link href="https://p0n4ik008.github.io/posts/army.html" />
    <id>https://p0n4ik008.github.io/posts/army.html</id>
    <published>09.03.2021</published>
    <updated>2021-03-09T00:00:00Z</updated>
    <summary type="html"><![CDATA[<p>
<a href="/posts/army.html">Армейские стандарты</a><br />
 9 марта 2021

</p>
<p><img src="../content/WhatsApp%20Image%202021-03-09%20at%2015.19.53.jpeg" width="742" /></p>
<div class="separator">
    
      Запощено в <a title="All pages tagged &#39;бабы&#39;." href="/tags/%D0%B1%D0%B0%D0%B1%D1%8B.html" rel="tag">бабы</a>
    
    <span class="disqus-comment-count" data-disqus-identifier="posts/army.md"></span>
</div>
]]></summary>
</entry>
<entry>
    <title>С 23 февраля!</title>
    <link href="https://p0n4ik008.github.io/posts/valentine.html" />
    <id>https://p0n4ik008.github.io/posts/valentine.html</id>
    <published>23.02.2021</published>
    <updated>2021-02-23T00:00:00Z</updated>
    <summary type="html"><![CDATA[<p>
<a href="/posts/valentine.html">С 23 февраля!</a><br />
23 февраля 2021

</p>
<figure>
<img src="../content/WhatsApp%20Image%202021-02-23%20at%2012.39.23.jpeg" alt="WhatsApp Image 2021-02-23 at 12.39.23" />
<figcaption aria-hidden="true">WhatsApp Image 2021-02-23 at 12.39.23</figcaption>
</figure>
<div class="separator">
    
      Запощено в <a title="All pages tagged &#39;бабы&#39;." href="/tags/%D0%B1%D0%B0%D0%B1%D1%8B.html" rel="tag">бабы</a>
    
    <span class="disqus-comment-count" data-disqus-identifier="posts/valentine.md"></span>
</div>
]]></summary>
</entry>
<entry>
    <title>Вилка-хуилка</title>
    <link href="https://p0n4ik008.github.io/posts/vilka.html" />
    <id>https://p0n4ik008.github.io/posts/vilka.html</id>
    <published>17.02.2021</published>
    <updated>2021-02-17T00:00:00Z</updated>
    <summary type="html"><![CDATA[<p>
<a href="/posts/vilka.html">Вилка-хуилка</a><br />
17 февраля 2021

</p>
<figure>
<img src="../content/nQv7CaZ-98g.jpg" alt="nQv7CaZ-98g" />
<figcaption aria-hidden="true">nQv7CaZ-98g</figcaption>
</figure>
<div class="separator">
    
      Запощено в <a title="All pages tagged &#39;бабы&#39;." href="/tags/%D0%B1%D0%B0%D0%B1%D1%8B.html" rel="tag">бабы</a>
    
    <span class="disqus-comment-count" data-disqus-identifier="posts/vilka.md"></span>
</div>
]]></summary>
</entry>
<entry>
    <title>Министр внутренних дел</title>
    <link href="https://p0n4ik008.github.io/posts/ministry.html" />
    <id>https://p0n4ik008.github.io/posts/ministry.html</id>
    <published>17.02.2021</published>
    <updated>2021-02-17T00:00:00Z</updated>
    <summary type="html"><![CDATA[<p>
<a href="/posts/ministry.html">Министр внутренних дел</a><br />
17 февраля 2021

</p>
<figure>
<img src="../content/M8KCKcLu7zU.jpg" alt="M8KCKcLu7zU" />
<figcaption aria-hidden="true">M8KCKcLu7zU</figcaption>
</figure>
<div class="separator">
    
      Запощено в <a title="All pages tagged &#39;сэкс&#39;." href="/tags/%D1%81%D1%8D%D0%BA%D1%81.html" rel="tag">сэкс</a>
    
    <span class="disqus-comment-count" data-disqus-identifier="posts/ministry.md"></span>
</div>
]]></summary>
</entry>
<entry>
    <title>Лицо с жопой</title>
    <link href="https://p0n4ik008.github.io/posts/horse.html" />
    <id>https://p0n4ik008.github.io/posts/horse.html</id>
    <published>17.02.2021</published>
    <updated>2021-02-17T00:00:00Z</updated>
    <summary type="html"><![CDATA[<p>
<a href="/posts/horse.html">Лицо с жопой</a><br />
17 февраля 2021

</p>
<figure>
<img src="../content/XubHLpUjTBI.jpg" alt="XubHLpUjTBI" />
<figcaption aria-hidden="true">XubHLpUjTBI</figcaption>
</figure>
<div class="separator">
    
      Запощено в <a title="All pages tagged &#39;бабы&#39;." href="/tags/%D0%B1%D0%B0%D0%B1%D1%8B.html" rel="tag">бабы</a>
    
    <span class="disqus-comment-count" data-disqus-identifier="posts/horse.md"></span>
</div>
]]></summary>
</entry>
<entry>
    <title>Манты</title>
    <link href="https://p0n4ik008.github.io/posts/manty.html" />
    <id>https://p0n4ik008.github.io/posts/manty.html</id>
    <published>03.02.2021</published>
    <updated>2021-02-03T00:00:00Z</updated>
    <summary type="html"><![CDATA[<p>
<a href="/posts/manty.html">Манты</a><br />
 3 февраля 2021

</p>
<figure>
<img src="../content/WhatsApp%20Image%202021-02-03%20at%2013.34.54.jpeg" alt="WhatsApp Image 2021-02-03 at 13.34.54" />
<figcaption aria-hidden="true">WhatsApp Image 2021-02-03 at 13.34.54</figcaption>
</figure>
<div class="separator">
    
      Запощено в <a title="All pages tagged &#39;сэкс&#39;." href="/tags/%D1%81%D1%8D%D0%BA%D1%81.html" rel="tag">сэкс</a>
    
    <span class="disqus-comment-count" data-disqus-identifier="posts/manty.md"></span>
</div>
]]></summary>
</entry>
<entry>
    <title>Хороший человек</title>
    <link href="https://p0n4ik008.github.io/posts/man.html" />
    <id>https://p0n4ik008.github.io/posts/man.html</id>
    <published>02.02.2021</published>
    <updated>2021-02-02T00:00:00Z</updated>
    <summary type="html"><![CDATA[<p>
<a href="/posts/man.html">Хороший человек</a><br />
 2 февраля 2021

</p>
<figure>
<img src="../content/WhatsApp%20Image%202021-02-02%20at%2020.48.21.jpeg" alt="WhatsApp Image 2021-02-02 at 20.48.21" />
<figcaption aria-hidden="true">WhatsApp Image 2021-02-02 at 20.48.21</figcaption>
</figure>
<div class="separator">
    
      Запощено в <a title="All pages tagged &#39;сэкс&#39;." href="/tags/%D1%81%D1%8D%D0%BA%D1%81.html" rel="tag">сэкс</a>
    
    <span class="disqus-comment-count" data-disqus-identifier="posts/man.md"></span>
</div>
]]></summary>
</entry>
<entry>
    <title>Сказочная эльфийка</title>
    <link href="https://p0n4ik008.github.io/posts/elf.html" />
    <id>https://p0n4ik008.github.io/posts/elf.html</id>
    <published>02.02.2021</published>
    <updated>2021-02-02T00:00:00Z</updated>
    <summary type="html"><![CDATA[<p>
<a href="/posts/elf.html">Сказочная эльфийка</a><br />
 2 февраля 2021

</p>
<p><span class="math inline"><video controls>
<source src="/content/WhatsApp Video 2021-02-02 at 20.57.47.mp4" preload="metadata">
</video>
</span></p>
<div class="separator">
    
      Запощено в <a title="All pages tagged &#39;сэкс&#39;." href="/tags/%D1%81%D1%8D%D0%BA%D1%81.html" rel="tag">сэкс</a>
    
    <span class="disqus-comment-count" data-disqus-identifier="posts/elf.md"></span>
</div>
]]></summary>
</entry>
<entry>
    <title>оптическая иллюзия</title>
    <link href="https://p0n4ik008.github.io/posts/optical.html" />
    <id>https://p0n4ik008.github.io/posts/optical.html</id>
    <published>15.01.2021</published>
    <updated>2021-01-15T00:00:00Z</updated>
    <summary type="html"><![CDATA[<p>
<a href="/posts/optical.html">оптическая иллюзия</a><br />
15 января 2021

</p>
<p><span class="math inline"><video controls>
<source src="/content/optical.mp4" preload="metadata">
</video>
</span></p>
<div class="separator">
    
      Запощено в <a title="All pages tagged &#39;бабы&#39;." href="/tags/%D0%B1%D0%B0%D0%B1%D1%8B.html" rel="tag">бабы</a>
    
    <span class="disqus-comment-count" data-disqus-identifier="posts/optical.md"></span>
</div>
]]></summary>
</entry>
<entry>
    <title>обезьяна с гранатой</title>
    <link href="https://p0n4ik008.github.io/posts/monkey.html" />
    <id>https://p0n4ik008.github.io/posts/monkey.html</id>
    <published>15.01.2021</published>
    <updated>2021-01-15T00:00:00Z</updated>
    <summary type="html"><![CDATA[<p>
<a href="/posts/monkey.html">обезьяна с гранатой</a><br />
15 января 2021

</p>
<p><span class="math inline"><video controls>
<source src="/content/monkey.mp4" preload="metadata">
</video>
</span></p>
<div class="separator">
    
      Запощено в <a title="All pages tagged &#39;оружие&#39;." href="/tags/%D0%BE%D1%80%D1%83%D0%B6%D0%B8%D0%B5.html" rel="tag">оружие</a>
    
    <span class="disqus-comment-count" data-disqus-identifier="posts/monkey.md"></span>
</div>
]]></summary>
</entry>
<entry>
    <title>золотое сечение</title>
    <link href="https://p0n4ik008.github.io/posts/hips.html" />
    <id>https://p0n4ik008.github.io/posts/hips.html</id>
    <published>10.01.2021</published>
    <updated>2021-01-10T00:00:00Z</updated>
    <summary type="html"><![CDATA[<p>
<a href="/posts/hips.html">золотое сечение</a><br />
10 января 2021

</p>
<p><span class="math inline">

<a href="/gallery/hips/portraitscam_134255981_389313622370977_9220871320806349818_n.jpg.html"><img src="/gallery/hips/portraitscam_134255981_389313622370977_9220871320806349818_n.thumb.jpg"/></a>
<link rel="prefetch" href="/gallery/hips/portraitscam_134255981_389313622370977_9220871320806349818_n.jpg">



<a href="/gallery/hips/portraitscam_134537189_1629123377271331_9159439282182827884_n.jpg.html"><img src="/gallery/hips/portraitscam_134537189_1629123377271331_9159439282182827884_n.thumb.jpg"/></a>
<link rel="prefetch" href="/gallery/hips/portraitscam_134537189_1629123377271331_9159439282182827884_n.jpg">



<a href="/gallery/hips/portraitscam_134948530_267565428040872_5551016331710671354_n.jpg.html"><img src="/gallery/hips/portraitscam_134948530_267565428040872_5551016331710671354_n.thumb.jpg"/></a>
<link rel="prefetch" href="/gallery/hips/portraitscam_134948530_267565428040872_5551016331710671354_n.jpg">



<a href="/gallery/hips/portraitscam_135032800_155466962718861_9083841721105855090_n.jpg.html"><img src="/gallery/hips/portraitscam_135032800_155466962718861_9083841721105855090_n.thumb.jpg"/></a>
<link rel="prefetch" href="/gallery/hips/portraitscam_135032800_155466962718861_9083841721105855090_n.jpg">



<a href="/gallery/hips/portraitscam_135042658_397835891523760_5900927991236466422_n.jpg.html"><img src="/gallery/hips/portraitscam_135042658_397835891523760_5900927991236466422_n.thumb.jpg"/></a>
<link rel="prefetch" href="/gallery/hips/portraitscam_135042658_397835891523760_5900927991236466422_n.jpg">



<a href="/gallery/hips/portraitscam_135054679_389519695685596_4073772997459585317_n.jpg.html"><img src="/gallery/hips/portraitscam_135054679_389519695685596_4073772997459585317_n.thumb.jpg"/></a>
<link rel="prefetch" href="/gallery/hips/portraitscam_135054679_389519695685596_4073772997459585317_n.jpg">



<a href="/gallery/hips/portraitscam_135304108_141452967631774_2001609281426947506_n.jpg.html"><img src="/gallery/hips/portraitscam_135304108_141452967631774_2001609281426947506_n.thumb.jpg"/></a>
<link rel="prefetch" href="/gallery/hips/portraitscam_135304108_141452967631774_2001609281426947506_n.jpg">



<a href="/gallery/hips/portraitscam_135322776_845998889467804_3977048858719612724_n.jpg.html"><img src="/gallery/hips/portraitscam_135322776_845998889467804_3977048858719612724_n.thumb.jpg"/></a>
<link rel="prefetch" href="/gallery/hips/portraitscam_135322776_845998889467804_3977048858719612724_n.jpg">



<a href="/gallery/hips/portraitscam_135393187_880255602515605_6512991070103888045_n.jpg.html"><img src="/gallery/hips/portraitscam_135393187_880255602515605_6512991070103888045_n.thumb.jpg"/></a>
<link rel="prefetch" href="/gallery/hips/portraitscam_135393187_880255602515605_6512991070103888045_n.jpg">



<a href="/gallery/hips/portraitscam_135397006_215444873567314_441164165562248536_n.jpg.html"><img src="/gallery/hips/portraitscam_135397006_215444873567314_441164165562248536_n.thumb.jpg"/></a>
<link rel="prefetch" href="/gallery/hips/portraitscam_135397006_215444873567314_441164165562248536_n.jpg">


</span></p>
<div class="separator">
    
      Запощено в <a title="All pages tagged &#39;бабы&#39;." href="/tags/%D0%B1%D0%B0%D0%B1%D1%8B.html" rel="tag">бабы</a>
    
    <span class="disqus-comment-count" data-disqus-identifier="posts/hips.md"></span>
</div>
]]></summary>
</entry>
<entry>
    <title>помогает</title>
    <link href="https://p0n4ik008.github.io/posts/ass.html" />
    <id>https://p0n4ik008.github.io/posts/ass.html</id>
    <published>05.01.2021</published>
    <updated>2021-01-05T00:00:00Z</updated>
    <summary type="html"><![CDATA[<p>
<a href="/posts/ass.html">помогает</a><br />
 5 января 2021

</p>
<p><span class="math inline">

<a href="/gallery/ass/photo_2021-01-06_16-23-19.jpg.html"><img src="/gallery/ass/photo_2021-01-06_16-23-19.thumb.jpg"/></a>
<link rel="prefetch" href="/gallery/ass/photo_2021-01-06_16-23-19.jpg">



<a href="/gallery/ass/photo_2021-01-06_16-23-22.jpg.html"><img src="/gallery/ass/photo_2021-01-06_16-23-22.thumb.jpg"/></a>
<link rel="prefetch" href="/gallery/ass/photo_2021-01-06_16-23-22.jpg">



<a href="/gallery/ass/photo_2021-01-06_16-23-27.jpg.html"><img src="/gallery/ass/photo_2021-01-06_16-23-27.thumb.jpg"/></a>
<link rel="prefetch" href="/gallery/ass/photo_2021-01-06_16-23-27.jpg">


</span></p>
<div class="separator">
    
      Запощено в <a title="All pages tagged &#39;бабы&#39;." href="/tags/%D0%B1%D0%B0%D0%B1%D1%8B.html" rel="tag">бабы</a>
    
    <span class="disqus-comment-count" data-disqus-identifier="posts/ass.md"></span>
</div>
]]></summary>
</entry>
<entry>
    <title>скучная поездка</title>
    <link href="https://p0n4ik008.github.io/posts/boring.html" />
    <id>https://p0n4ik008.github.io/posts/boring.html</id>
    <published>17.12.2020</published>
    <updated>2020-12-17T00:00:00Z</updated>
    <summary type="html"><![CDATA[<p>
<a href="/posts/boring.html">скучная поездка</a><br />
17 декабря 2020

</p>
<p><span class="math inline"><video controls>
<source src="/content/boring.mp4" preload="metadata">
</video>
</span></p>
<div class="separator">
    
      Запощено в <a title="All pages tagged &#39;бабы&#39;." href="/tags/%D0%B1%D0%B0%D0%B1%D1%8B.html" rel="tag">бабы</a>
    
    <span class="disqus-comment-count" data-disqus-identifier="posts/boring.md"></span>
</div>
]]></summary>
</entry>
<entry>
    <title>экзамен по вождению</title>
    <link href="https://p0n4ik008.github.io/posts/exam.html" />
    <id>https://p0n4ik008.github.io/posts/exam.html</id>
    <published>02.12.2020</published>
    <updated>2020-12-02T00:00:00Z</updated>
    <summary type="html"><![CDATA[<p>
<a href="/posts/exam.html">экзамен по вождению</a><br />
 2 декабря 2020

</p>
<p><img src="/content/exam.jpg" /></p>
<div class="separator">
    
      Запощено в <a title="All pages tagged &#39;сэкс&#39;." href="/tags/%D1%81%D1%8D%D0%BA%D1%81.html" rel="tag">сэкс</a>
    
    <span class="disqus-comment-count" data-disqus-identifier="posts/exam.md"></span>
</div>
]]></summary>
</entry>
<entry>
    <title>позы при коронавирусе</title>
    <link href="https://p0n4ik008.github.io/posts/coronasutra.html" />
    <id>https://p0n4ik008.github.io/posts/coronasutra.html</id>
    <published>01.12.2020</published>
    <updated>2020-12-01T00:00:00Z</updated>
    <summary type="html"><![CDATA[<p>
<a href="/posts/coronasutra.html">позы при коронавирусе</a><br />
 1 декабря 2020

</p>
<p><img src="/content/coronasutra.jpg" /></p>
<div class="separator">
    
      Запощено в <a title="All pages tagged &#39;сэкс&#39;." href="/tags/%D1%81%D1%8D%D0%BA%D1%81.html" rel="tag">сэкс</a>
    
    <span class="disqus-comment-count" data-disqus-identifier="posts/coronasutra.md"></span>
</div>
]]></summary>
</entry>
<entry>
    <title>нежнее шёлка</title>
    <link href="https://p0n4ik008.github.io/posts/silk.html" />
    <id>https://p0n4ik008.github.io/posts/silk.html</id>
    <published>26.11.2020</published>
    <updated>2020-11-26T00:00:00Z</updated>
    <summary type="html"><![CDATA[<p>
<a href="/posts/silk.html">нежнее шёлка</a><br />
26 ноября 2020

</p>
<p><img src="/content/silk.jpeg" width="742" /></p>
<div class="separator">
    
      Запощено в <a title="All pages tagged &#39;бабы&#39;." href="/tags/%D0%B1%D0%B0%D0%B1%D1%8B.html" rel="tag">бабы</a>
    
    <span class="disqus-comment-count" data-disqus-identifier="posts/silk.md"></span>
</div>
]]></summary>
</entry>
<entry>
    <title>цирк приехал</title>
    <link href="https://p0n4ik008.github.io/posts/circus.html" />
    <id>https://p0n4ik008.github.io/posts/circus.html</id>
    <published>26.11.2020</published>
    <updated>2020-11-26T00:00:00Z</updated>
    <summary type="html"><![CDATA[<p>
<a href="/posts/circus.html">цирк приехал</a><br />
26 ноября 2020

</p>
<p><span class="math inline"><video controls>
<source src="/content/circus.mp4" preload="metadata">
</video>
</span></p>
<div class="separator">
    
      Запощено в <a title="All pages tagged &#39;сэкс&#39;." href="/tags/%D1%81%D1%8D%D0%BA%D1%81.html" rel="tag">сэкс</a>
    
    <span class="disqus-comment-count" data-disqus-identifier="posts/circus.md"></span>
</div>
]]></summary>
</entry>
<entry>
    <title>дозаправка в воздухе</title>
    <link href="https://p0n4ik008.github.io/posts/dozapravka.html" />
    <id>https://p0n4ik008.github.io/posts/dozapravka.html</id>
    <published>25.11.2020</published>
    <updated>2020-11-25T00:00:00Z</updated>
    <summary type="html"><![CDATA[<p>
<a href="/posts/dozapravka.html">дозаправка в воздухе</a><br />
25 ноября 2020

</p>
<p><span class="math inline"><video controls>
<source src="/content/dozapravka.mp4" preload="metadata">
</video>
</span></p>
<div class="separator">
    
      Запощено в <a title="All pages tagged &#39;сэкс&#39;." href="/tags/%D1%81%D1%8D%D0%BA%D1%81.html" rel="tag">сэкс</a>
    
    <span class="disqus-comment-count" data-disqus-identifier="posts/dozapravka.md"></span>
</div>
]]></summary>
</entry>
<entry>
    <title>сюрприз</title>
    <link href="https://p0n4ik008.github.io/posts/surpise.html" />
    <id>https://p0n4ik008.github.io/posts/surpise.html</id>
    <published>20.11.2020</published>
    <updated>2020-11-20T00:00:00Z</updated>
    <summary type="html"><![CDATA[<p>
<a href="/posts/surpise.html">сюрприз</a><br />
20 ноября 2020

</p>
<p><span class="math inline"><video controls>
<source src="/content/surprise.mp4" preload="metadata">
</video>
</span></p>
<div class="separator">
    
      Запощено в <a title="All pages tagged &#39;сэкс&#39;." href="/tags/%D1%81%D1%8D%D0%BA%D1%81.html" rel="tag">сэкс</a>
    
    <span class="disqus-comment-count" data-disqus-identifier="posts/surpise.md"></span>
</div>
]]></summary>
</entry>
<entry>
    <title>Old school</title>
    <link href="https://p0n4ik008.github.io/posts/oldschool.html" />
    <id>https://p0n4ik008.github.io/posts/oldschool.html</id>
    <published>18.11.2020</published>
    <updated>2020-11-18T00:00:00Z</updated>
    <summary type="html"><![CDATA[<p>
<a href="/posts/oldschool.html">Old school</a><br />
18 ноября 2020

</p>
<p><img src="/content/oldschool.jpg" /></p>
<div class="separator">
    
      Запощено в <a title="All pages tagged &#39;сэкс&#39;." href="/tags/%D1%81%D1%8D%D0%BA%D1%81.html" rel="tag">сэкс</a>
    
    <span class="disqus-comment-count" data-disqus-identifier="posts/oldschool.md"></span>
</div>
]]></summary>
</entry>
<entry>
    <title>вы бы масочку надели</title>
    <link href="https://p0n4ik008.github.io/posts/masochka.html" />
    <id>https://p0n4ik008.github.io/posts/masochka.html</id>
    <published>11.11.2020</published>
    <updated>2020-11-11T00:00:00Z</updated>
    <summary type="html"><![CDATA[<p>
<a href="/posts/masochka.html">вы бы масочку надели</a><br />
11 ноября 2020

</p>
<p><img src="/content/masochka.jpg" /></p>
<div class="separator">
    
      Запощено в <a title="All pages tagged &#39;бабы&#39;." href="/tags/%D0%B1%D0%B0%D0%B1%D1%8B.html" rel="tag">бабы</a>
    
    <span class="disqus-comment-count" data-disqus-identifier="posts/masochka.md"></span>
</div>
]]></summary>
</entry>
<entry>
    <title>вот тебе напарник</title>
    <link href="https://p0n4ik008.github.io/posts/naparnik.html" />
    <id>https://p0n4ik008.github.io/posts/naparnik.html</id>
    <published>10.11.2020</published>
    <updated>2020-11-10T00:00:00Z</updated>
    <summary type="html"><![CDATA[<p>
<a href="/posts/naparnik.html">вот тебе напарник</a><br />
10 ноября 2020

</p>
<p><span class="math inline"><video controls>
<source src="/content/naparnik.mp4" preload="metadata">
</video>
</span></p>
<div class="separator">
    
      Запощено в <a title="All pages tagged &#39;бабы&#39;." href="/tags/%D0%B1%D0%B0%D0%B1%D1%8B.html" rel="tag">бабы</a>
    
    <span class="disqus-comment-count" data-disqus-identifier="posts/naparnik.md"></span>
</div>
]]></summary>
</entry>
<entry>
    <title>нихрена себе акробатика</title>
    <link href="https://p0n4ik008.github.io/posts/aerobics.html" />
    <id>https://p0n4ik008.github.io/posts/aerobics.html</id>
    <published>09.11.2020</published>
    <updated>2020-11-09T00:00:00Z</updated>
    <summary type="html"><![CDATA[<p>
<a href="/posts/aerobics.html">нихрена себе акробатика</a><br />
 9 ноября 2020

</p>
<p><span class="math inline"><video controls>
<source src="/content/aerobics.mp4" preload="metadata">
</video>
</span></p>
<div class="separator">
    
      Запощено в <a title="All pages tagged &#39;бабы&#39;." href="/tags/%D0%B1%D0%B0%D0%B1%D1%8B.html" rel="tag">бабы</a>
    
    <span class="disqus-comment-count" data-disqus-identifier="posts/aerobics.md"></span>
</div>
]]></summary>
</entry>
<entry>
    <title>восточный танец</title>
    <link href="https://p0n4ik008.github.io/posts/dance2.html" />
    <id>https://p0n4ik008.github.io/posts/dance2.html</id>
    <published>30.08.2020</published>
    <updated>2020-08-30T00:00:00Z</updated>
    <summary type="html"><![CDATA[<p>
<a href="/posts/dance2.html">восточный танец</a><br />
30 августа 2020

</p>
<p><span class="math inline"><video controls>
<source src="/content/dance2.mp4" preload="metadata">
</video>
</span></p>
<div class="separator">
    
      Запощено в <a title="All pages tagged &#39;бабы&#39;." href="/tags/%D0%B1%D0%B0%D0%B1%D1%8B.html" rel="tag">бабы</a>
    
    <span class="disqus-comment-count" data-disqus-identifier="posts/dance2.md"></span>
</div>
]]></summary>
</entry>
<entry>
    <title>я буду долго гнать велосипед</title>
    <link href="https://p0n4ik008.github.io/posts/velik2.html" />
    <id>https://p0n4ik008.github.io/posts/velik2.html</id>
    <published>28.08.2020</published>
    <updated>2020-08-28T00:00:00Z</updated>
    <summary type="html"><![CDATA[<p>
<a href="/posts/velik2.html">я буду долго гнать велосипед</a><br />
28 августа 2020

</p>
<p><span class="math inline"><video controls>
<source src="/content/velik2.mp4" preload="metadata">
</video>
</span></p>
<div class="separator">
    
      Запощено в <a title="All pages tagged &#39;сэкс&#39;." href="/tags/%D1%81%D1%8D%D0%BA%D1%81.html" rel="tag">сэкс</a>
    
    <span class="disqus-comment-count" data-disqus-identifier="posts/velik2.md"></span>
</div>
]]></summary>
</entry>
<entry>
    <title>это из-за волос</title>
    <link href="https://p0n4ik008.github.io/posts/hair.html" />
    <id>https://p0n4ik008.github.io/posts/hair.html</id>
    <published>25.08.2020</published>
    <updated>2020-08-25T00:00:00Z</updated>
    <summary type="html"><![CDATA[<p>
<a href="/posts/hair.html">это из-за волос</a><br />
25 августа 2020

</p>
<p><span class="math inline"><video controls>
<source src="/content/hair.mp4" preload="metadata">
</video>
</span></p>
<div class="separator">
    
      Запощено в <a title="All pages tagged &#39;бабы&#39;." href="/tags/%D0%B1%D0%B0%D0%B1%D1%8B.html" rel="tag">бабы</a>
    
    <span class="disqus-comment-count" data-disqus-identifier="posts/hair.md"></span>
</div>
]]></summary>
</entry>
<entry>
    <title>сегодня пятница</title>
    <link href="https://p0n4ik008.github.io/posts/friday.html" />
    <id>https://p0n4ik008.github.io/posts/friday.html</id>
    <published>21.08.2020</published>
    <updated>2020-08-21T00:00:00Z</updated>
    <summary type="html"><![CDATA[<p>
<a href="/posts/friday.html">сегодня пятница</a><br />
21 августа 2020

</p>
<p><span class="math inline"><video controls>
<source src="/content/friday.mp4" preload="metadata">
</video>
</span></p>
<div class="separator">
    
      Запощено в <a title="All pages tagged &#39;бабы&#39;." href="/tags/%D0%B1%D0%B0%D0%B1%D1%8B.html" rel="tag">бабы</a>, <a title="All pages tagged &#39;сэкс&#39;." href="/tags/%D1%81%D1%8D%D0%BA%D1%81.html" rel="tag">сэкс</a>
    
    <span class="disqus-comment-count" data-disqus-identifier="posts/friday.md"></span>
</div>
]]></summary>
</entry>
<entry>
    <title>пусть всегда будет водка колбоса и селедка</title>
    <link href="https://p0n4ik008.github.io/posts/right.html" />
    <id>https://p0n4ik008.github.io/posts/right.html</id>
    <published>27.07.2020</published>
    <updated>2020-07-27T00:00:00Z</updated>
    <summary type="html"><![CDATA[<p>
<a href="/posts/right.html">пусть всегда будет водка колбоса и селедка</a><br />
27 июля 2020

</p>
<p><img src="/content/right.jpeg" /></p>
<div class="separator">
    
      Запощено в <a title="All pages tagged &#39;бабы&#39;." href="/tags/%D0%B1%D0%B0%D0%B1%D1%8B.html" rel="tag">бабы</a>
    
    <span class="disqus-comment-count" data-disqus-identifier="posts/right.md"></span>
</div>
]]></summary>
</entry>
<entry>
    <title>теребим соски</title>
    <link href="https://p0n4ik008.github.io/posts/nipples.html" />
    <id>https://p0n4ik008.github.io/posts/nipples.html</id>
    <published>27.07.2020</published>
    <updated>2020-07-27T00:00:00Z</updated>
    <summary type="html"><![CDATA[<p>
<a href="/posts/nipples.html">теребим соски</a><br />
27 июля 2020

</p>
<p><span class="math inline"><video controls>
